fire_name,county,cost,burnt_acres,startDate,finishDate,latitude,longitude,injuries,destroyedStructures,threatenedStructures,airtankers,dozers,fireEngines,firePersonnel,fireCrews,helicopters,waterTenders,meanTemp,maxTemp,minTemp,dewPoint,avgHumidity,maxHumidity,minHumidity,fire,maxWind
Buckeye Fire Incident Information: ,Humboldt,2.778696,205,9/6/10 09:36,9/10/10 18:00,41.02844534,-123.9584647,5,2,,,2,20,640,24,2,2,57,73,43,45,76,97,31,1,32
Highway 71 Fire Incident Information: ,San Bernardino,,2,9/11/10 16:43,9/12/10 20:00,33.9507817,-117.6767941,,,,,,,,,,,64,82,46,52,72,94,41,1,24
Canyon Fire Incident Information: ,Kern,,9820,9/12/10 13:54,9/20/10 07:30,35.6221013,-118.4828185,,,,,,,,,,,82,97,66,45,33,55,10,1,26
Oregon Fire Incident Information: ,Butte,,40,9/18/10 20:34,9/20/10 07:30,39.5784744,-121.528333,,,,,,,,,,,72,84,61,59,74,100,40,1,23
Whitlock Fire Incident Information: ,Mariposa,,69,9/18/10 16:43,9/19/10 18:30,38.34348864,-120.4292029,,,,,,,,,,,68,82,52,50,62,94,32,1,18
Rainbow Fire Incident Information: ,Riverside,,3,9/24/10 15:52,9/24/10 20:35,33.82000253,-116.5679503,,,,,,,,,,,,81,55,,,,,1,0
Bodega Fire Incident Information: ,Sonoma,,98,9/25/10 12:30,9/26/10 11:50,38.317535,-123.03223,,,,,,,,,,,72,93,50,48,58,94,15,1,14
Lake Fire Incident Information: ,San Luis Obispo,,112,10/9/10 18:36,10/11/10 09:00,35.7552665,-120.9001033,,,,,,,,,,,,59,52,,,,,1,0
Border Fire 12 Incident Information: ,San Diego,,50,10/10/10 13:10,10/11/10 08:30,38.06297796,-122.0816453,,,,,,,,,,,64,81,48,54,71,96,45,1,23
Bridge Fire Incident Information: ,Placer,,56,10/11/10 15:50,10/12/10 08:30,38.7517232,-121.3586011,,,,,,,,,,,72,88,57,50,48,77,20,1,14
Antelope Fire Incident Information: ,San Luis Obispo,,185,10/26/10 15:04,10/27/10 08:00,35.00412687,-120.1138706,,,0,,,,,,,,57,73,43,36,52,87,18,1,24
Rocky Fire Incident Information: ,San Luis Obispo,,25,10/29/10 12:33,10/29/10 16:00,35.21944837,-120.1916783,,,,,,,,,,,55,72,39,37,62,93,31,1,23
Wetsel Fire Incident Information: ,Sacramento,,155,11/3/10 13:56,11/3/10 16:00,38.5290306,-121.3350068,,,,,,,,,,,64,77,52,52,64,94,41,1,13
Scott Fire Incident Information: ,San Bernardino,,125,11/6/10 13:35,11/6/10 22:15,36.38244623,-116.4089809,,,0,2,2,26,181,6,2,,63,79,52,34,36,86,16,1,39
Pacific Fire Incident Information: ,Riverside,,45,11/14/10 12:20,11/14/10 14:45,34.0101923,-117.4188585,,,,,,,,,,,63,81,45,28,27,73,15,1,26
Southern California Flooding Incident Information: ,Orange,,,12/18/10 08:00,12/25/10 10:00,33.5415413,-117.7798538,,,,,,,,,,,55,61,54,57,100,100,100,1,8
Highland Flooding Incident Incident Information: ,San Bernardino,,,12/22/10 05:30,1/1/11 08:00,34.1283442,-117.2086513,,,,,,,,,,,52,57,46,54,98,100,77,1,21
California Tsunami Incident Information: ,Riverside,,,3/11/11 01:00,3/13/11 09:00,33.482093,-117.096106,,,,,,,,,,,,63,41,,,,,1,0
Center Fire Incident Information: ,Inyo,,850,3/18/11 15:18,3/20/11 19:00,37.166632,-118.2940696,1,19,,,,10,100,4,,,43,64,21,7,33,60,5,1,32
Bitterwater Fire Incident Information: ,San Luis Obispo,,187,5/2/11 13:01,5/2/11 18:00,35.69285136,-120.7999947,,,,,,,,,,,,54,46,,,,,1,0
Metz Fire Incident Information: ,Monterey,,832,5/12/11 18:18,5/14/11 08:00,34.7765109,-120.5944182,,1,,,1,10,125,5,1,2,64,82,48,48,67,93,30,1,21
Seven Fire Incident Information: ,San Luis Obispo,,70,5/14/11 13:45,5/14/11 15:30,35.54852576,-119.9165536,,,,,,,,,,,,,,,,,,1,0
Cove Fire Incident Information: ,Kern,,1122,5/27/11 12:30,5/31/11 08:00,35.6496772,-118.4141196,,,,,,,,,,,64,77,50,43,48,64,31,1,24
Cattleman Fire Incident Information: ,Monterey,,384,5/29/11 15:53,5/29/11 20:00,36.0447506,-120.9172191,,,,,,,,,,,,55,48,,,,,1,0
Round Up Fire Incident Information: ,San Bernardino,,144,6/1/11 08:54,6/2/11 19:30,35.71621733,-116.8516166,,,,,,,,,,,66,75,55,19,17,32,11,1,48
Trilogy Fire Incident Information: ,Riverside,,160,6/2/11 12:22,6/7/11 09:00,33.7666071,-117.4872029,,,,,,,,,,,55,73,39,43,61,96,31,1,24
Bee Fire Incident Information: ,San Diego,,100,6/5/11 15:42,6/6/11 19:00,32.6073868,-116.7716968,,,,,,,,,,,55,75,36,34,47,79,14,1,29
Key Fire Incident Information: ,Kern,,151,6/5/11 18:36,6/10/11 19:00,35.62583,-118.51,,,,,,,,,,,72,82,57,52,62,90,33,1,37
Cougar  Fire Incident Information: ,Modoc,,2000,6/8/11 15:00,6/13/11 19:00,37.03024012,-118.3639963,,,,,,,,,,,66,86,48,34,40,66,13,1,32
Bowen Fire Incident Information: ,San Bernardino,,295,6/9/11 18:39,6/10/11 18:00,34.3633526,-117.1621269,,,,,,,,,,,,77,52,,,,,1,0
Canyon Fire Incident Information: ,Riverside,,55,6/11/11 15:26,6/12/11 19:00,33.99249355,-116.5702316,,,,,,,,,,,,79,52,,,,,1,0
Eastman Fire Incident Information: ,Stanislaus,,257,6/11/11 17:53,6/11/11 20:30,37.818619,-120.673369,,,,,,,,,,,66,81,52,48,57,83,30,1,21
Grant Fire Incident Information: ,Alameda,,175,6/14/11 22:20,6/14/11 14:00,37.7457619,-121.6582839,,,,,,,,,,,75,93,57,54,51,80,22,1,26
Antelope Fire Incident Information: ,Kern,,5196,6/19/11 10:15,6/22/11 08:00,34.49930795,-118.1709777,1,2,,,4,17,439,18,2,2,,81,55,,,,,1,0
Canyon Fire Incident Information: ,Fresno,,133,6/19/11 20:15,6/20/11 19:00,36.10193735,-119.6588227,1,0,,,1,19,271,12,1,,73,91,57,54,52,77,27,1,19
Canyon Fire Incident Information: ,Trinity,,30,6/20/11 16:07,6/21/11 06:30,40.7300308,-123.0547346,,,,,,,,,,,68,91,46,46,56,93,20,1,10
Border 9 FIre Incident Information: ,San Diego,,380,6/21/11 06:30,6/21/11 08:00,32.6430502,-116.1078334,,,,,,,,,,,73,93,52,46,45,72,18,1,34
Quinn Fire Incident Information: ,Kern,,3147,6/21/11 12:15,6/21/11 18:00,35.7761309,-119.0533099,,,,,,,,,,,90,106,73,54,29,43,15,1,26
Hughes Fire Incident Information: ,Los Angeles,,100,6/23/11 11:00,6/23/11 13:00,34.4909905,-118.2856169,,,,,,,,,,,,81,57,,,,,1,0
Billy Fire Incident Information: ,Merced,,140,6/23/11 14:41,6/23/11 19:00,37.0386382,-120.9708499,,,,,,,,,,,64,79,50,52,73,100,39,1,32
Sage Fire Incident Information: ,Riverside,,134,6/24/11 12:55,6/25/11 18:00,33.77065824,-116.3485474,,,,,,,,,,,,86,54,,,,,1,0
Telegraph Fire Incident Information: ,Calaveras,,25,6/24/11 16:00,6/24/11 16:55,37.9426396,-120.7174024,,,,,,,,,,,75,93,61,45,28,55,15,1,16
Cobblestone Fire Incident Information: ,Stanislaus,,206,6/24/11 14:30,6/24/11 18:50,37.8159939,-120.78188,,,,,,,,,,,75,93,61,45,28,55,15,1,16
Eastman Fire Incident Information: ,Stanislaus,,300,6/24/11 13:50,6/24/11 18:50,37.8422578,-120.8341921,,,,,,,,,,,75,93,61,45,28,55,15,1,16
Highway Fire Incident Information: ,San Luis Obispo,,438,6/24/11 15:20,6/24/11 18:15,35.662438,-120.3753305,,,,,,,,,,,70,91,48,46,55,93,16,1,35
Rest Fire Incident Information: ,Merced,,576,6/26/11 12:12,6/26/11 18:30,36.8638125,-120.884147,,,,,,,,,,,63,79,46,50,72,100,39,1,32
Lago Fire Incident Information: ,Riverside,,25,6/27/11 11:13,6/27/11 00:45,33.62382589,-116.3695577,,,,,,,,,,,93,113,73,30,22,41,3,1,35
Hornitos Fire Incident Information: ,Mariposa,,19,6/27/11 12:28,6/27/11 13:30,37.5028757,-120.2343778,,,,,,,,,,,77,95,59,52,49,78,19,1,16
Stage Fire Incident Information: ,Tulare,0.839,1213,6/27/11 13:44,6/30/11 07:30,35.8905051,-118.9151972,,,,,,8,110,4,,2,84,100,66,48,32,47,16,1,23
Wheelabrator Fire Incident Information: ,Shasta,,35,6/27/11 16:45,6/27/11 18:30,34.09475701,-120.8103815,,,,,,,,,,,,,,,,,,1,0
Spanish Fire Incident Information: ,Humboldt,,498,7/1/11 20:52,7/3/11 09:30,41.17244904,-123.9576631,,,,,,,,,,,52,59,48,50,92,100,78,1,21
Deep Fire Incident Information: ,San Bernardino,,119,7/3/11 16:05,7/5/11 19:00,34.3960996,-117.1620698,,,,,,,,,,,,88,57,,,,,1,0
Chrisman Fire Incident Information: ,San Joaquin,,400,7/5/11 16:37,7/5/11 20:30,37.6387078,-121.4017783,,,,,,,,,,,75,91,59,55,55,80,30,1,21
Krista Fire Incident Information: ,Yuba,,350,7/9/11 16:06,7/11/11 10:30,39.15708271,-121.3861554,2,,0,,,8,90,4,,,79,90,70,55,47,64,22,1,19
Granite Fire Incident Information: ,Tulare,,832,7/9/11 15:49,7/11/11 19:00,36.0666185,-118.966819,1,6,0,,1,8,90,5,1,2,81,99,64,55,41,73,20,1,21
School Fire Incident Information: ,Riverside,,40,7/13/11 14:04,7/13/11 20:30,33.9383923,-116.8854646,,,,,,,,,,,,90,59,,,,,1,0
Flynn Fire Incident Information: ,Alameda,,400,7/14/11 13:15,7/14/11 15:30,37.7440174,-121.6477867,,,,,,,,,,,63,70,55,52,70,86,53,1,35
White Fire Incident Information: ,Sacramento,,30,7/14/11 14:07,7/14/11 16:45,38.5290306,-121.3350068,,,,,,,,,,,64,77,54,50,63,94,34,1,13
Buffalo Fire Incident Information: ,San Diego,,26,7/15/11 15:22,7/16/11 09:00,32.6176338,-116.1844417,,,,,,,,,,,61,79,43,46,61,100,21,1,32
Scorpion Complex Incident Information: ,Modoc,,2945,7/15/11 18:45,7/18/11 09:00,35.62816244,-117.9235941,,,,,,,,,,,73,88,63,,,,,1,23
Whitewater Fire Incident Information: ,Riverside,,80,7/19/11 10:28,7/19/11 14:05,33.65255586,-117.5216024,,,,,,,,,,,72,90,54,54,53,81,30,1,26
Hahn Fire Incident Information: ,Colusa,,80,7/19/11 15:57,7/19/11 18:30,39.1085102,-122.6202048,,,,5,1,4,,1,1,,73,86,61,54,55,78,31,1,14
San Tim Fire Incident Information: ,Riverside,,80,7/20/11 13:58,7/20/11 19:30,33.38931646,-117.7859347,,,,,,,,,,,70,88,52,55,66,100,31,1,26
Pony Fire Incident Information: ,Riverside,,35,7/21/11 12:25,7/21/11 21:45,33.5582976,-116.7183795,,,,,,,,,,,,90,59,,,,,1,0
McDonald Fire Incident Information: ,Santa Clara,,27,7/21/11 16:50,7/21/11 18:55,37.12137682,-121.7290167,,,,,,,,,,,64,77,54,54,79,100,44,1,32
Eastman Fire Incident Information: ,Madera,,292,7/21/11 20:02,7/21/11 22:30,36.87521474,-120.3349379,,,,,4,14,,,,2,84,99,68,50,37,61,12,1,24
Flynn Fire Incident Information: ,Alameda,,517,7/21/11 21:32,7/22/11 08:20,37.75723246,-121.615517,,,,,,,,,,,75,91,57,54,57,87,26,1,26
Eagle Fire Incident Information: ,San Diego,15.5,14100,7/21/11 22:40,8/1/11 07:00,33.2769753,-116.6494394,18,1,,,1,,8,,,6,68,73,64,59,71,78,60,1,16
Middle Fire Incident Information: ,Calaveras,,100,7/22/11 16:48,7/24/11 04:50,38.1145286,-121.5741027,,,,,,,,,,,64,73,55,55,75,93,57,1,29
Romero Fire Incident Information: ,Merced,,489,7/23/11 08:43,7/23/11 14:00,37.49567207,-121.0509336,,,,,,,,,,,82,99,64,55,48,73,22,1,19
Revis Fire Incident Information: ,Madera,,30,7/24/11 13:00,7/24/11 18:00,37.23669759,-120.6835388,,,,,,,,,,,79,95,61,55,55,84,26,1,16
Murray Fire Incident Information: ,Calaveras,,83,7/25/11 13:44,7/28/11 09:00,36.0823789,-117.9981643,1,,,,3,31,558,18,1,0,90,100,81,,,,,1,32
Southridge Fire Incident Information: ,Sutter,,112,7/27/11 15:40,7/27/11 18:20,39.1214733,-121.6111047,,,,,,,,,,,75,91,63,48,35,59,22,1,14
Tyler 3 Incident Information: ,Tulare,,25,7/30/11 17:37,8/1/11 07:30,35.8860541,-118.730104,,,,,,2,47,2,,,88,100,73,57,36,47,24,1,23
MMU Lightning Complex Incident Information: ,Madera,,129,7/31/11 12:40,8/3/11 08:00,37.5012528,-119.9863602,,,,,,,40,2,,,81,97,64,61,55,78,32,1,21
Lion Fire Incident Information: ,Tulare,,,7/31/11 14:43,8/12/11 17:00,36.19445904,-118.7122809,,,,,,,,,,,82,97,70,64,60,83,37,1,14
Pass Fire Incident Information: ,Mendocino,2.8,617,8/3/11 12:03,8/9/11 17:30,39.20832194,-123.6443004,1,,0,,,6,257,6,,4,73,93,52,50,55,83,26,1,21
Sites Fire Incident Information: ,Colusa,,55,8/3/11 21:42,8/4/11 11:30,39.3120516,-122.3381242,,,,,,,,,,,,,,,,,,1,0
Barn Fire Incident Information: ,San Benito,,36,8/6/11 14:30,8/6/11 18:00,36.2049929,-121.2875463,,,,2,1,7,,,1,,,59,52,,,,,1,0
Rosa Fire Incident Information: ,San Benito,,73,8/6/11 15:00,8/6/11 18:00,36.893784,-121.3499813,,,,,,,,,,,64,73,55,55,85,100,57,1,34
Gilman Fire Incident Information: ,Riverside,,945,8/6/11 16:01,8/7/11 18:00,33.87006954,-116.8655275,,,,,,,,,,,,91,61,,,,,1,0
Yeager Fire Incident Information: ,Yuba,,140,8/11/11 15:55,8/12/11 20:00,39.31146737,-121.1716783,,,,,,,,,,,79,90,68,48,37,44,22,1,21
Ardo Fire Incident Information: ,Monterey,,94,8/12/11 15:54,8/12/11 21:00,35.9482841,-120.8771282,,,,2,1,5,70,1,1,,,59,52,,,,,1,0
Knoxville Fire Incident Information: ,Napa,,508,8/13/11 14:45,8/15/11 11:00,38.5516204,-122.2314164,,,0,0,,14,190,6,3,,64,75,54,54,77,100,53,1,26
Reliz Fire Incident Information: ,Monterey,,214,8/16/11 15:30,8/18/11 21:00,36.2423747,-121.2394702,1,,,,4,22,376,15,,5,,59,52,,,,,1,0
Annie Fire Incident Information: ,Modoc,,,8/18/11 11:00,8/19/11 08:56,41.8605328,-120.15207,,,,,,,,,,,64,88,43,34,40,70,9,1,23
Garza Fire Incident Information: ,Riverside,,189,8/22/11 14:32,8/23/11 07:30,33.93057938,-117.1859917,,,,,,,,,,,70,90,54,55,62,94,29,1,24
Ken Fire Incident Information: ,San Bernardino,,,8/22/11 13:03,8/23/11 08:40,33.92919386,-121.1650312,,,,,,,,,,,,,,,,,,1,0
Patterson Fire Incident Information: ,Alameda,,147,8/23/11 12:13,8/23/11 18:10,37.5303401,-121.7027787,,,,4,2,12,,2,2,,77,97,57,52,56,93,19,1,19
Motor Fire Incident Information: ,Mariposa,,5231,8/25/11 12:00,9/6/11 10:00,37.4452109,-119.9132039,,,,,,,,,,,79,97,61,54,50,78,22,1,16
Barrett Fire Incident Information: ,San Diego,,95,8/27/11 13:04,8/28/11 10:00,38.12082491,-122.7624388,1,,,1,1,10,115,6,2,4,64,75,52,54,77,100,54,1,32
Oasis Fire Incident Information: ,Los Angeles,1,355,8/27/11 13:44,8/30/11 18:30,34.78115014,-118.6154436,3,,,,,5,11,,,,91,108,75,52,28,40,16,1,13
Argyle Fire Incident Information: ,Monterey,,200,8/27/11 13:51,8/29/11 09:00,34.77232454,-121.4989163,,,,,3,6,130,5,,4,,,,,,,,1,0
Beacon Fire Incident Information: ,Solano,,715,8/27/11 17:50,8/29/11 06:00,38.2874213,-121.9757531,,,,,2,20,250,8,,4,64,75,52,54,77,100,54,1,32
Florida Fire Incident Information: ,San Bernardino,,67,8/28/11 11:41,8/30/11 07:00,34.0858248,-117.1122301,2,,0,,,14,117,4,,3,81,97,64,61,51,81,31,1,27
Yosemite Fire Incident Information: ,San Luis Obispo,,85,8/28/11 16:27,8/28/11 18:30,35.662438,-120.3753305,,,,,,,,,,,77,102,50,46,51,93,9,1,23
Ridge Fire Incident Information: ,San Diego,,150,8/28/11 14:29,8/31/11 08:00,32.6458338,-116.487197,,,,,,,,,,,86,102,70,59,47,73,21,1,81
Pala Fire Incident Information: ,San Diego,1.81,223,8/29/11 10:30,8/31/11 19:00,33.373659,-117.0791325,1,,,,3,9,136,4,,5,,90,61,,,,,1,0
Wildcat Fire Incident Information: ,San Diego,,60,8/29/11 15:07,8/29/11 20:00,33.0022032,-116.805801,,,,,,,,,,,72,79,66,63,81,94,62,1,14
Watts Fire Incident Information: ,Fresno,,75,8/29/11 13:00,8/29/11 21:30,36.8969472,-119.4384111,,,,,,,,,,,84,102,68,52,35,57,13,1,23
Keller Fire Incident Information: ,Riverside,,458,8/29/11 13:01,8/29/11 19:00,33.6147826,-117.1673385,,,,,,,,,,,81,95,64,59,57,81,33,1,26
Hawkinsville Fire  Incident Information: ,Siskiyou,,120,9/1/11 16:05,9/4/11 18:00,39.46927686,-123.0638167,,,,,1,13,207,8,,2,75,97,52,48,47,77,16,1,16
Hill Fire Incident Information: ,San Bernardino,,1158,9/2/11 13:00,9/4/11 17:30,34.4114326,-117.3921437,,,,,,,,,,,70,86,54,55,67,100,32,1,21
Soda Fire Incident Information: ,San Luis Obispo,,1300,9/3/11 14:57,9/4/11 21:00,35.227468,-119.8901979,,,,,,,,,,,61,70,54,52,76,93,59,1,16
Red Fire Incident Information: ,Tuolumne,,121,9/3/11 17:00,9/4/11 09:00,37.826063,-120.473921,,,,,,,,,,,81,100,61,50,47,78,16,1,19
Figueroa Fire Incident Information: ,Santa Barbara,,698,9/3/11 13:00,9/6/11 10:00,34.9530337,-120.4357191,,,,,,,,,,,66,88,46,48,71,100,19,1,21
Roadrunner Fire Incident Information: ,Tulare,,335,9/4/11 13:42,9/5/11 12:00,35.5810814,-118.4329117,,,,,,,,,,,82,100,64,45,27,37,16,1,23
Canyon Fire Incident Information: ,Kern,10.3,14585,9/4/11 11:30,9/10/11 20:30,35.0716304,-118.417488,7,100,,,,5,23,,,1,79,100,55,30,18,34,7,1,32
Wagon Wheel Fire Incident Information: ,Los Angeles,,345,9/5/11 12:54,9/7/11 12:00,33.89201615,-117.7178176,,,,,,,,,,,79,93,64,59,59,84,34,1,19
Banning Fire Incident Information: ,Riverside,,55,9/7/11 13:59,9/7/11 17:30,33.9317071,-116.9461583,,,,,,,,,,,82,102,64,59,49,87,25,1,23
Freccero Fire Incident Information: ,Calaveras,,57,9/7/11 16:23,9/9/11 15:30,38.1820202,-120.569239,,,,,,,,,,,79,99,59,39,31,51,10,1,14
Branch 2 Fire Incident Information: ,Mariposa,,40,9/9/11 16:39,9/11/11 07:00,37.520864,-119.982315,,,,,,10,,4,1,2,79,95,61,52,48,72,23,1,13
Milton Fire Incident Information: ,Stanislaus,,1112,9/9/11 19:00,9/10/11 09:00,37.9447524,-120.8437537,,,,,,,,,,,81,97,63,52,45,65,24,1,27
Keene Complex Fires Incident Information: ,Kern,7.2,10470,9/10/11 02:30,9/14/11 08:00,35.62137871,-115.7137589,4,,,,6,95,1416,48,1,1,,,,,,,,1,0
Comanche Fire Complex Incident Information: ,Kern,,29338,9/10/11 04:00,9/16/11 06:00,35.2017986,-118.833105,6,,,,9,32,603,18,,3,88,99,75,55,35,48,21,1,32
Breckenridge Complex Incident Information: ,Kern,7.4,25213,9/10/11 10:55,9/18/11 08:00,34.59571746,-117.1893295,2,,,,,15,451,16,2,4,79,90,70,57,51,78,33,1,29
Hurricane Complex (Previously Santa Lucia Lighting Complex) Incident Information: ,Santa Barbara,,262,9/10/11 11:00,9/12/11 19:45,34.9684358,-120.4203834,,,,,,,,,,,66,81,52,54,73,100,42,1,26
South Lightning (Tennessee Fire) Incident Information: ,Tulare,,407,9/11/11 12:00,9/14/11 10:00,34.28917705,-118.5992737,,,,,,1,,,,,,86,59,,,,,1,0
John Fire Incident Information: ,Inyo,,5353,9/13/11 13:54,9/16/11 07:00,37.30587236,-118.5174617,2,,0,,,,,,,,68,84,52,43,47,77,17,1,39
TCU September Lightning Incident Information: ,Calaveras,,1135,9/9/11 07:33,9/15/11 15:00,32.8152582,-116.9730613,,,,,,,,,,,66,72,63,57,76,88,64,1,16
Southern Region Lightning Incident Information: ,Los Angeles,,10000,9/9/11 22:00,9/15/11 12:00,34.0446749,-118.4539715,,,,,,,,,,,,88,61,,,,,1,0
Mint Fire Incident Information: ,Los Angeles,,634,9/17/11 08:00,12/31/69 16:00,34.512825,-118.3406374,,,,,,,,,,,,86,59,,,,,1,0
West Fire Incident Information: ,Fresno,,40,9/23/11 14:30,9/23/11 22:00,36.246262,-120.3153196,,,,,,,,,,,81,99,61,55,52,84,20,1,21
Ruth Fire Incident Information: ,Trinity,,1460,9/23/11 12:00,9/29/11 08:00,40.57427765,-123.1875791,,,,,,,,,,,70,95,46,43,48,81,11,1,8
Kern County Lightning Fires Incident Information: ,Kern,,20,9/23/11 17:00,9/24/11 12:40,34.9431265,-115.513177,,,,,,,,,,,,,,,,,,1,0
Tulare County Lightning Fires Incident Information: ,Tulare,,400,9/23/11 21:45,9/29/11 08:00,36.2967312,-119.141313,,,,,,,,,,,81,99,64,54,41,64,19,1,13
Honey Fire Incident Information: ,Butte,,70,9/24/11 14:00,9/24/11 17:00,39.7109383,-121.7669705,,,,,,,,,,,79,91,64,50,45,68,20,1,32
Windy Point Fire Incident Information: ,Riverside,,541,9/24/11 18:53,9/29/11 08:00,33.60429297,-117.2000057,,,,,,,,,,,68,77,61,59,79,96,55,1,27
Buckeye Fire Incident Information: ,Mono,,1040,9/25/11 11:00,9/29/11 08:00,38.36931289,-118.8624041,,,,,,,,,,,50,66,37,34,55,83,28,1,27
San Diego County Lightning Fires Incident Information: ,San Diego,,56,9/30/11 14:33,10/1/11 21:00,33.3524478,-116.7392735,0,,0,5,1,23,363,15,3,1,66,75,61,59,82,94,66,1,14
Great Fire Incident Information: ,San Diego,,2135,10/1/11 12:53,10/6/11 07:00,33.63820224,-118.5141877,1,,,,3,15,379,10,1,5,72,84,61,43,35,70,23,1,23
Mill Fire Incident Information: ,San Bernardino,,42,10/21/11 14:27,10/22/11 19:30,34.28329958,-120.3114521,,,,,,,,,,,64,77,54,52,80,94,44,1,13
Loma Fire Incident Information: ,Napa,,90,11/1/11 21:05,11/2/11 08:30,38.3763353,-122.2821288,,,,,,,,,,,61,75,43,25,51,93,8,1,53
Yager Fire Incident Information: ,Humboldt,,60,11/10/11 11:08,11/11/11 17:30,40.537821,-124.05984,,,,,,,,,,,52,64,39,39,70,93,28,1,14
198 Fire Incident Information: ,Monterey,,75,11/30/11 21:35,12/1/11 11:30,36.1952406,-120.7101721,,,,,,,,,,,52,66,36,36,58,92,24,1,39
El Dorado Complex Incident Information: ,El Dorado,,132,12/1/11 11:00,12/4/11 17:30,38.7275566,-120.8263496,2,,,,,2,76,2,,,54,63,45,16,22,37,13,1,27
Tuolumne-Calaveras Wind Event Incident Information: ,Tuolumne,,781,12/1/11 07:08,12/6/11 14:00,37.97503717,-120.1585832,3,,,,1,22,205,6,1,1,48,59,37,9,19,30,11,1,26
Chalk Fire Incident Information: ,Nevada,,20,12/1/11 14:54,12/2/11 09:00,37.7421328,-122.4113356,,,,,,,,,,,57,70,45,19,24,35,13,1,47
Collier Fire Incident Information: ,Contra Costa,,198,12/1/11 18:05,12/2/11 09:00,37.7755563,-121.8287018,,,,,,,,,,,57,70,45,19,24,35,13,1,47
 Soda Fire Incident Information: ,Napa,,200,2/23/12 12:32,2/25/12 08:30,38.357363,-122.2873083,2,,,,1,5,95,5,,,57,79,37,32,56,100,11,1,42
Border #6 Fire Incident Information: ,San Diego,,150,5/17/12 08:32,5/18/12 18:00,36.24629241,-118.077535,,,,1,,20,180,8,4,4,,,,,,,,1,0
Banner Fire Incident Information: ,San Diego,4,5321,5/24/12 14:09,5/29/12 12:00,33.97408636,-117.1436315,4,,,5,2,21,461,18,7,6,63,70,55,54,71,94,57,1,26
Cedar Fire Incident Information: ,Riverside,,40,5/25/12 17:09,5/26/12 07:45,33.48019061,-116.9247003,,,,,,,,,,,,77,52,,,,,1,0
Lakepointe Fire Incident Information: ,Riverside,,256,5/27/12 15:38,5/28/12 06:30,33.4076842,-116.088764,,,,,,,,,,,73,90,57,36,36,62,9,1,27
Paloma Fire Incident Information: ,Calaveras,,37,5/30/12 18:11,6/1/12 08:00,38.2593394,-120.7441047,,,,,,,,,,,68,90,48,46,49,94,16,1,23
Billy Fire Incident Information: ,Merced,,434,5/31/12 11:37,5/31/12 15:30,36.87084463,-120.9809815,,,,,,,,,,,68,88,46,50,63,100,29,1,31
Blue Fire Incident Information: ,Shasta,,42,6/2/12 15:45,6/2/12 20:15,40.6612477,-122.1966317,,,,,,,,,,,66,81,54,45,46,82,22,1,24
George Fire Incident Information: ,Tulare,,1707,6/1/12 15:42,6/14/12 18:45,36.065451,-119.0519235,,,,,,,,,,,82,100,64,54,40,64,17,1,16
Pine Fire Incident Information: ,Fresno,,91,6/5/12 14:43,6/6/12 18:00,36.8227671,-119.3657227,,,,4,2,13,130,4,2,2,63,73,52,39,48,72,23,1,39
Fine Fire Incident Information: ,Madera,,23,6/7/12 13:40,6/8/12 09:00,37.4211922,-120.8600512,,,0,,1,4,,2,,1,72,90,52,46,43,67,19,1,34
5 Mile Fire Incident Information: ,Los Angeles,,525,6/8/12 14:17,6/9/12 19:30,34.73187211,-117.8101149,,,,,,,,,,,75,90,61,39,29,45,15,1,45
Creek Fire Incident Information: ,Riverside,,76,6/8/12 17:29,6/9/12 20:30,33.72155372,-116.4295962,,,,,,,,,,,,77,52,,,,,1,0
Casino Fire Incident Information: ,Yolo,,260,6/9/12 12:41,6/9/12 19:30,38.73433,-122.142141,,,,,,,,,,,63,86,39,34,49,89,8,1,32
Windy Fire Incident Information: ,Butte,,97,6/10/12 14:39,6/11/12 18:45,35.35845005,-120.3867013,,,0,,2,15,200,10,1,7,66,91,43,34,38,65,10,1,24
Gaines Fire Incident Information: ,Mariposa,,1667,6/12/12 12:45,6/14/12 18:45,38.26162665,-119.7165716,1,,0,4,6,2,199,2,4,6,55,79,34,21,30,61,8,1,26
Little Fire Incident Information: ,San Bernardino,,88,6/14/12 08:36,6/15/12 08:45,34.315134,-117.3552154,,,,,,,,,,,68,79,57,54,70,90,42,1,27
Fiddyment Fire Incident Information: ,Placer,,184,6/14/12 13:23,6/14/12 15:30,38.8388895,-121.3494157,,,,,,,,,,,79,90,66,54,43,64,21,1,16
Foothill Fire Incident Information: ,Mendocino,,7,6/14/12 16:24,6/15/12 18:30,39.7900885,-123.2672023,,,,,,,,,,,,,,,,,,1,0
Pond Fire Incident Information: ,Mendocino,,33,6/14/12 17:20,6/15/12 18:30,39.51181287,-123.3960736,,,,,,,,,,,72,86,55,39,42,67,17,1,35
Palermo Fire Incident Information: ,Butte,,100,6/15/12 14:10,6/15/12 16:15,39.4639695,-121.5788486,,2,55,,,,,,,,81,99,61,52,39,66,16,1,27
Welch Fire Incident Information: ,Alameda,,60,6/15/12 15:15,6/16/12 09:00,37.5357884,-121.8530247,,,,,4,3,,4,3,,73,91,54,45,45,72,18,1,29
Waltz Fire Incident Information: ,Placer,,105,6/15/12 17:30,6/15/12 19:00,36.28422087,-121.0696022,,,,,1,16,,2,,4,63,73,52,46,61,83,38,1,32
Highland Fire Incident Information: ,Riverside,,2171,6/16/12 13:20,6/18/12 18:45,33.82328422,-117.4169597,,,,,,,,,,,64,82,48,55,69,94,44,1,0
Old Fire Incident Information: ,San Diego,,995,6/17/12 14:00,6/20/12 18:00,37.58947092,-117.0042301,2,2,0,4,6,25,354,14,4,5,75,93,57,7,12,23,1,1,35
Wohlford Fire Incident Information: ,San Diego,,2,6/17/12 16:00,6/17/12 18:30,33.2018791,-116.9714382,,,,,,,,,,,64,72,59,57,81,87,68,1,14
View Fire Incident Information: ,Riverside,,376,6/18/12 21:15,6/18/12 18:45,33.95030038,-117.5337431,,,,,,,,,,,70,86,55,57,74,100,37,1,0
Skyline Fire Incident Information: ,Tehama,,85,6/19/12 12:48,6/19/12 16:30,40.2547361,-122.2661881,,,,,,,,,,,81,93,68,28,16,31,4,1,32
Otay Fire Incident Information: ,San Diego,,30,6/20/12 14:07,6/21/12 08:00,32.650795,-116.853502,,,,,,,,,,,63,88,39,36,41,70,11,1,34
Horseshoe Fire Incident Information: ,Calaveras,,95,6/21/12 13:46,6/21/12 17:20,37.9559214,-120.6867161,,,,,,,,,,,75,88,63,46,43,63,23,1,32
Hill Fire Incident Information: ,Ventura,,689,6/23/12 12:22,6/24/12 16:00,34.8242444,-118.9462656,,,,,,,,,,,,81,57,,,,,1,0
Oak Fire Incident Information: ,Siskiyou,,192,6/28/12 14:50,6/30/12 05:45,41.632206,-122.838162,1,,,4,2,9,,6,1,5,61,79,43,39,49,83,23,1,13
Cary Fire Incident Information: ,Riverside,,150,6/29/12 00:42,6/30/12 09:00,33.5699462,-116.7364691,,,,6,4,25,,10,4,4,,88,55,,,,,1,0
Dale Fire Incident Information: ,Shasta,,1038,7/5/12 13:54,7/7/12 18:00,38.44099543,-122.233359,1,7,0,,2,46,840,26,6,6,64,75,54,52,67,89,44,1,32
Thunder Fire Incident Information: ,Glenn,,167,7/7/12 12:13,7/7/12 14:30,39.5392738,-122.3326425,,,,,,,,,,,81,99,63,43,30,52,13,1,19
Butte Fire Incident Information: ,Tehama,,140,7/7/12 14:39,7/7/12 15:55,39.9228822,-122.3530192,,,,,,,,,,,81,99,63,43,30,52,13,1,19
Fish Fire Incident Information: ,Inyo,,1103,7/7/12 13:59,7/9/12 19:30,37.068144,-118.2406519,,,0,,1,2,103,4,,9,75,99,52,28,26,43,8,1,45
Mill Fire Incident Information: ,Colusa,,29502,7/7/12 15:00,7/19/12 08:00,39.6030447,-122.8275434,,,,,,,,,,,75,99,52,43,45,77,12,1,23
Oregon Fire Incident Information: ,Butte,,60,7/8/12 15:25,7/8/12 19:45,36.19046741,-119.8298838,,,,4,1,20,,,2,4,81,100,63,48,44,72,15,1,24
Sites Complex Incident Information: ,Colusa,,5,7/8/12 15:45,7/12/12 19:30,39.3506818,-122.4090494,,,,2,4,37,712,26,6,6,,,,,,,,1,0
Turkey Fire Incident Information: ,Monterey,,2700,7/9/12 11:25,7/11/12 19:15,35.8769232,-120.4169582,,,,,4,28,357,14,,3,75,100,50,48,57,100,13,1,37
Panorama Fire Incident Information: ,San Bernardino,,75,7/9/12 13:54,7/9/12 18:00,34.76908526,-119.0802679,,,,,,,,,,,64,73,54,55,75,100,49,1,16
Seven Fire Incident Information: ,Tuolumne,,840,7/10/12 13:41,7/11/12 08:35,37.811075,-120.4667972,,1,,3,1,12,100,3,1,,82,102,63,48,38,60,15,1,27
La Grange Fire Incident Information: ,Tuolumne,,103,7/10/12 13:00,7/10/12 18:30,37.6991615,-120.4244444,,,,2,2,12,92,2,1,,82,102,63,48,38,60,15,1,27
Twin Fire Incident Information: ,Riverside,,45,7/11/12 06:26,7/11/12 00:10,33.8685799,-116.7911387,,,,,,,,,,,,88,57,,,,,1,0
