fire_name,county,cost,burnt_acres,startDate,finishDate,latitude,longitude,injuries,destroyedStructures,threatenedStructures,airtankers,dozers,fireEngines,firePersonnel,fireCrews,helicopters,waterTenders,meanTemp,maxTemp,minTemp,dewPoint,avgHumidity,maxHumidity,minHumidity,fire,maxWind
Marina Fire Incident Information: ,Mono,,650,6/25/16 06:30,7/9/16 08:30,37.8869652,-119.0906643,,,,,,,,,,,61,88,36,27,32,68,9,1,14
Grant Fire Incident Information: ,Alameda,,211,6/25/16 16:11,6/26/16 07:00,37.7457619,-121.6582839,,,,,,,,,,,81,99,61,45,37,63,10,1,29
Dinosaur Fire Incident Information: ,Merced,,1246,6/25/16 23:45,6/26/16 18:50,37.056069,-121.1137544,,,,,,,,,,,72,93,52,52,57,94,26,1,34
Laguna Fire Incident Information: ,Orange,,47,6/26/16 13:10,6/29/16 18:30,33.78049315,-117.7197672,,,,,,,,,,,75,93,57,63,68,93,39,1,29
Creek Fire Incident Information: ,Yolo,,277,6/26/16 15:45,6/27/16 06:15,38.73433,-122.142141,,,,,,,,,,,70,88,52,54,67,96,37,1,27
Reservoir Fire Incident Information: ,Lake,,215,6/26/16 16:00,6/28/16 20:00,39.1192096,-122.5401025,,0,0,,7,25,350,14,2,2,75,99,54,43,40,72,8,1,24
Frazier Fire Incident Information: ,San Luis Obispo,,86,6/27/16 12:07,6/29/16 17:00,35.46062347,-120.1589003,,,,,,,,,,,84,109,61,43,33,56,9,1,34
Campo Fire Incident Information: ,Calaveras,,33,6/27/16 18:00,6/30/16 07:00,36.5338507,-119.6624786,,,,,,,,,,,90,106,72,50,21,29,12,1,32
Trailhead Fire Incident Information: ,El Dorado,,5646,6/28/16 13:55,7/18/16 09:50,38.9171495,-121.0132496,3,,602,,,,,,,,86,99,73,46,27,41,12,1,14
Rancho Fire Incident Information: ,Amador,,372,6/28/16 19:02,6/29/16 07:30,38.3528544,-120.9327694,,,,,,,,,,,86,104,70,48,30,53,9,1,19
Colyear Fire Incident Information: ,Tehama,,464,6/30/16 13:32,7/4/16 07:45,39.93004969,-121.9241598,,,,,,,,,,,86,102,72,52,35,61,11,1,19
Pine Fire Incident Information: ,Ventura,,2304,6/30/16 16:55,6/30/16 16:55,34.1326098,-118.9266514,,,,,,,,,,,,84,59,,,,,1,0
Flores Fire Incident Information: ,Tehama,,88,7/1/16 13:54,7/1/16 17:45,40.0858654,-122.2175932,,,,,,,,,,,86,99,75,52,32,44,18,1,19
Deer Fire Incident Information: ,Kern,,1785,7/1/16 14:05,7/11/16 09:40,35.3774321,-118.3708037,3,,,,4,110,1118,29,8,5,86,104,70,46,25,34,14,1,40
Curry Fire Incident Information: ,Fresno,,2944,7/1/16 17:16,7/5/16 07:05,36.51308738,-119.8796569,,,,,5,29,188,12,2,13,90,106,72,50,35,57,12,1,26
Lone Pine Fire Incident Information: ,Inyo,,30,7/1/16 12:56,7/2/16 20:00,36.5952407,-118.1601641,,,,,,,,,,,,,,,,,,1,0
Appaloosa Fire Incident Information: ,Calaveras,,310,7/2/16 14:55,7/8/16 19:32,38.0274138,-120.6109423,,,,,,,,,,,82,99,68,54,42,63,21,1,26
Frame Fire Incident Information: ,Fresno,,145,7/4/16 17:15,7/7/16 19:00,36.56210438,-120.4057287,,,,,,,,,,,82,99,68,54,39,57,21,1,0
Broken Fire Incident Information: ,Madera,,103,7/4/16 11:53,7/6/16 20:00,37.01469293,-119.7822456,,,,,,,,,,,82,99,66,50,37,56,17,1,29
Kuehner Fire Incident Information: ,Ventura,,45,7/1/16 14:00,7/1/16 19:50,34.3144612,-118.6431477,,,,,,,,,,,,84,59,,,,,1,0
Fort Fire Incident Information: ,Kern,,554,7/8/16 11:15,7/10/16 19:37,33.721836,-117.774558,,,,,,,,,,,72,88,57,61,70,96,42,1,29
Fiddler Fire Incident Information: ,Shasta,,441,7/8/16 22:45,7/12/16 07:00,37.54837189,-119.847887,1,1,,,,20,241,10,,5,,,,,,,,1,0
Sage Fire Incident Information: ,Los Angeles,,1109,7/9/16 12:04,7/16/16 12:00,34.54474908,-118.6793167,,,,,,,,,,,,86,61,,,,,1,0
Mercury Fire Incident Information: ,San Benito,,95,7/9/16 12:43,7/10/16 19:30,36.0959455,-120.7004281,,,,,,,,,,,77,97,57,52,51,86,16,1,39
Scott Fire Incident Information: ,Sacramento,,87,7/10/16 15:30,7/11/16 06:35,38.5290306,-121.3350068,,,,,,,,,,,66,81,52,41,46,82,15,1,19
Big Fire Incident Information: ,Fresno,,188,7/11/16 14:30,7/13/16 17:30,36.94494208,-120.0816402,,,,,,,,,,,77,91,61,45,38,60,15,1,26
Shelter Fire Incident Information: ,Ventura,,15,7/11/16 12:58,7/12/16 10:30,33.1050948,-116.6024843,,,,,,,,,,,68,72,64,61,78,87,68,1,23
Pacheco Fire Incident Information: ,Calaveras,,341,7/12/16 13:14,7/16/16 18:30,35.44228538,-120.9906374,,,,,,,,,,,,57,50,,,,,1,0
Stagecoach Fire Incident Information: ,Calaveras,,35,7/12/16 15:19,7/13/16 19:00,34.41978065,-121.1820424,,,,,,,,,,,,,,,,,,1,0
Briggs Fire Incident Information: ,Riverside,,173,7/12/16 15:20,7/15/16 08:00,33.43599088,-117.12629,,,,,,,,,,,,90,57,,,,,1,0
Sherwood Fire Incident Information: ,Ventura,,78,7/13/16 15:52,7/15/16 14:00,34.1402713,-118.857829,,,,,,,,,,,,88,61,,,,,1,0
Onyx Fire Incident Information: ,Kern,,221,7/13/16 17:08,7/14/16 12:00,33.98661496,-117.2796032,,,,,,,,,,,75,93,61,63,67,93,38,1,27
Dunnigan Fire Incident Information: ,Yolo,,84,7/15/16 14:00,7/15/16 15:40,34.32434812,-118.9272965,,,,,,,,,,,,88,61,,,,,1,0
Famoso Fire Incident Information: ,Kern,,138,7/15/16 23:55,7/16/16 07:40,35.4629091,-116.1918681,,,,,,,,,,,90,104,75,27,12,19,5,1,45
Green Fire Incident Information: ,Fresno,,123,7/15/16 16:45,7/16/16 18:00,36.99942764,-119.4983086,,,,,,,,,,,88,104,72,48,30,47,12,1,26
Feather Fire Incident Information: ,San Diego,,100,7/18/16 13:08,7/20/16 13:45,34.78282276,-118.5533585,,,,,,,,,,,,88,61,,,,,1,0
Foothill Fire Incident Information: ,Lake,,69,7/19/16 17:16,7/22/16 18:15,39.43137524,-123.1462604,,,,,,4,14,,,,70,84,54,48,56,83,28,1,23
Bailey Fire Incident Information: ,Siskiyou,,3,7/19/16 14:09,7/20/16 09:00,40.54690738,-122.222963,,,,,,,,,,,,95,63,,,,,1,0
Serpa Fire Incident Information: ,Madera,,80,7/21/16 12:53,7/25/16 19:20,37.2489086,-119.7035929,,,,,,,,,,,82,99,66,46,33,49,17,1,29
Baker Fire Incident Information: ,Calaveras,,57,7/21/16 15:06,7/22/16 19:00,34.4012448,-118.3916146,,,,,,,,,,,,88,61,,,,,1,0
Roblar Fire Incident Information: ,San Diego,,1245,7/21/16 16:06,7/30/16 14:15,33.3889429,-117.3520293,,,,,,,,,,,81,100,61,54,42,72,17,1,24
Table Fire Incident Information: ,Siskiyou,,23,7/21/16 20:30,7/22/16 12:00,41.97489832,-121.9572827,,,,,,,,,,,63,84,43,39,46,77,14,1,35
Oak Fire Incident Information: ,Solano,,57,7/22/16 13:01,7/22/16 16:07,38.26631519,-122.1312456,,,,,,,,,,,63,81,45,52,68,96,39,1,32
Soberanes Fire Incident Information: ,Monterey,,132127,7/22/16 08:48,10/13/16 11:30,36.4679829,-121.9074861,,,,,,,,,,,61,70,50,52,75,93,56,1,23
Storksbill Fire Incident Information: ,El Dorado,,50,7/22/16 13:15,7/23/16 18:00,37.90850673,-120.8573334,,,,,,,,,,,79,99,57,48,46,72,17,1,37
Sand Fire Incident Information: ,Los Angeles,,,7/22/16 14:11,8/9/16 17:15,34.4243002,-118.4248187,,,,,,,,,,,,88,61,,,,,1,0
Rock Fire Incident Information: ,San Diego,,28,7/22/16 14:47,7/24/16 14:30,33.001493,-116.958059,,,,,,,,,,,75,84,66,66,79,100,49,1,14
Bradley Fire Incident Information: ,Monterey,,100,7/22/16 15:15,7/23/16 08:45,35.08672101,-119.997736,,,,,,,,,,,72,93,52,48,56,94,20,1,26
Franklin Fire Incident Information: ,Contra Costa,,40,7/24/16 16:30,7/24/16 19:00,38.0141799,-122.190557,,,,,,,,,,,66,82,50,55,67,93,40,1,32
Collier Fire Incident Information: ,Tehama,,11,7/25/16 16:55,7/26/16 19:25,40.36418189,-122.2502798,,,,,,,,,,,88,106,70,50,31,57,5,1,24
Neal Fire Incident Information: ,Butte,,35,7/28/16 14:27,7/29/16 15:10,37.51734749,-118.6808585,,,,,,,,,,,86,108,64,41,26,44,8,1,50
Fork Fire Incident Information: ,Madera,,38,7/29/16 17:55,7/31/16 18:55,37.05470684,-120.180463,,,,,,,,,,,91,109,75,48,29,50,7,1,26
North Branch Extension Fire Incident Information: ,Lake,,25,7/29/16 14:55,7/31/16 18:50,39.0069271,-122.6114105,,,,,,,,,,,70,88,50,52,66,100,31,1,24
Goose Fire Incident Information: ,Fresno,,2241,7/30/16 16:40,8/9/16 18:30,36.30852072,-120.2096534,,18,,,,7,167,4,,6,91,106,81,57,30,48,17,1,0
Frymire Fire Incident Information: ,Tuolumne,,32,7/30/16 17:25,8/1/16 08:05,37.880787,-120.5420204,,,,,,,,,,,88,108,70,52,36,53,13,1,26
Sierra Fire Incident Information: ,Santa Clara,,114,7/30/16 17:25,7/31/16 18:30,37.15636583,-121.6922971,,,,,,,,,,,64,79,52,55,80,100,47,1,29
Dockery Fire Incident Information: ,Lassen,,42,7/30/16 16:25,8/1/16 19:40,39.58543592,-119.7996177,,,,,,,,,,,79,95,63,39,25,45,13,1,27
99 Fire Incident Information: ,Butte,,550,8/2/16 14:35,8/3/16 08:00,39.6657791,-121.7436951,,,,,,,,,,,81,95,64,48,34,49,18,1,19
Cold Fire Incident Information: ,Yolo,,5731,8/2/16 16:36,8/12/16 15:00,35.28767521,-121.5779006,,2,,,,5,58,2,,,,59,52,,,,,1,0
Baker Fire Incident Information: ,Tehama,,80,8/3/16 17:27,8/4/16 07:50,40.36513828,-122.0825975,,,,,,,,,,,84,106,64,46,30,61,4,1,19
Diablo Fire Incident Information: ,Stanislaus,,100,8/3/16 16:08,8/4/16 07:45,37.7430946,-119.6230614,,,,,,,,,,,,,,,,,,1,0
Grub Fire Incident Information: ,Madera,,85,8/4/16 14:13,8/6/16 19:50,37.2478651,-119.6520567,,,,,,,,,,,84,100,68,46,33,57,9,1,23
Hart Fire Incident Information: ,Kern,,100,8/4/16 17:10,8/7/16 20:15,35.2418453,-118.5888308,,,,,,,,,,,90,102,75,45,23,35,11,1,19
Deer Fire Incident Information: ,Amador,,26,8/5/16 13:49,8/6/16 10:06,38.5180216,-120.50895,,,,,1,8,,2,,3,72,90,54,39,35,59,12,1,13
Pilot Fire Incident Information: ,San Bernardino,,8110,8/7/16 12:18,8/16/16 08:00,34.27002,-117.290277,1,,,0,3,37,960,30,10,7,72,88,57,63,74,94,46,1,29
Clark Fire Incident Information: ,Mono,,2819,8/4/16 14:09,8/7/16 19:14,37.8055474,-118.9591662,,,,,,,,,,,68,82,52,36,31,56,17,1,34
Alder Fire Incident Information: ,El Dorado,,25,8/6/16 15:00,8/7/16 19:18,38.7189033,-120.504675,,,,,,,,,,,73,88,61,39,29,50,14,1,16
Rock Creek Fire Incident Information: ,Mono,,122,8/5/16 15:45,8/7/16 19:33,38.04169176,-119.3708095,,,,,,,,,,,57,81,39,21,25,43,12,1,23
Maze Fire Incident Information: ,Stanislaus,,140,8/4/16 15:45,8/4/16 20:00,33.9772975,-117.8818359,,,,,,,,,,,75,90,63,63,64,90,40,1,27
Mineral Fire Incident Information: ,Fresno,,7050,8/9/16 13:08,8/18/16 19:00,36.0948641,-120.5218986,,4,0,,,,20,,,,79,97,61,46,34,69,18,1,19
Mountain Fire Incident Information: ,Shasta,,35,8/9/16 12:14,8/10/16 17:00,40.6313122,-122.4638027,,,,,,,,,,,,95,61,,,,,1,0
Kugelman Fire Incident Information: ,Lake,,45,8/9/16 17:30,8/10/16 17:00,39.109152,-122.7275688,,,,,,,,,,,75,93,55,50,50,77,23,1,23
Knoxville Fire Incident Information: ,Lake,,36,8/9/16 18:50,8/10/16 17:00,38.93877784,-123.1503366,,,,,,,,,,,70,88,48,52,65,96,34,1,26
Gopher Fire Incident Information: ,San Diego,,35,8/10/16 09:14,8/11/16 18:30,33.84685446,-116.3055675,,,,,,,,,,,,91,61,,,,,1,0
Stafford Fire Incident Information: ,Humboldt,,23,8/11/16 14:57,8/16/16 08:45,40.594771,-124.142111,,,,,,,,,,,57,63,52,54,96,100,75,1,13
Oak Fire Incident Information: ,Santa Clara,,25,8/12/16 16:00,8/14/16 19:50,37.0611378,-121.6748562,,,,,,,,,,,66,79,54,55,81,100,47,1,35
Summit Fire Incident Information: ,Humboldt,,21,8/12/16 17:23,8/19/16 08:30,40.9492983,-123.7083888,,,,,,,,,,,55,61,52,52,97,100,78,1,11
Chimney Fire Incident Information: ,San Luis Obispo,,46344,8/13/16 16:03,9/6/16 07:30,35.5836773,-120.0763427,1,78,,,,,,,,,81,106,54,46,42,72,12,1,29
Clayton Fire Incident Information: ,Lake,,3929,8/13/16 18:03,8/26/16 18:00,38.9019359,-122.6117255,,328,,,,2,32,,1,,70,90,48,50,65,100,29,1,23
Blue Cut Fire Incident Information: ,San Bernardino,,36274,8/16/16 10:44,8/23/16 07:45,33.97554465,-120.1076923,,324,,,6,47,914,21,5,9,66,73,59,61,83,100,66,1,21
Cedar Fire Incident Information: ,Kern,,29322,8/16/16 16:35,10/1/16 06:00,34.85284257,-116.5778255,,,,,,,,,,,88,102,75,19,9,14,5,1,32
Bailey Fire Incident Information: ,Santa Clara,,100,8/17/16 15:19,8/18/16 19:50,37.2080659,-121.7214515,,,,,,,,,,,66,81,54,55,83,100,39,1,32
Beale Fire Incident Information: ,Yuba,,400,8/18/16 15:35,8/18/16 21:30,39.31495091,-121.3370286,,,,,,,,,,,82,97,68,48,31,46,16,1,14
Rey Fire  Incident Information: ,Santa Barbara,,32606,8/18/16 17:57,9/15/16 15:20,34.5334159,-119.8576768,,,,,,,,,,,72,93,50,48,69,100,11,1,29
Bird Fire Incident Information: ,San Joaquin,,147,8/20/16 08:35,8/20/16 18:45,37.6387078,-121.4017783,,,,,,,,,,,64,72,57,54,67,80,53,1,32
Tully Fire Incident Information: ,Humboldt,,599,8/22/16 16:03,9/4/16 06:55,41.12432616,-123.8477806,,3,,,1,10,174,3,,2,55,63,52,52,97,100,78,1,13
Tule Fire Incident Information: ,Tulare,,395,8/22/16 22:00,11/8/16 10:15,36.13037,-118.818317,,,,,,,,,,,75,91,63,54,44,72,23,1,16
Grade Fire Incident Information: ,Siskiyou,,710,8/24/16 14:55,8/30/16 06:45,41.7406155,-122.6332008,,11,,,,,,,,,68,90,45,37,39,65,16,1,14
Range Fire Incident Information: ,Kern,,518,8/26/16 10:10,8/29/16 10:30,35.60861766,-118.2397447,,,,,,,,,,,,97,63,,,,,1,0
Santos Fire Incident Information: ,Butte,,88,8/26/16 15:30,8/30/16 18:40,37.30425974,-120.2773883,,,,,,,,,,,73,90,57,52,51,80,21,1,19
Willow Fire Incident Information: ,Calaveras,,450,8/28/16 13:07,8/31/16 18:50,36.87556946,-120.1868152,,,,,,,,,,,79,93,63,54,49,72,26,1,21
Evergreen Fire Incident Information: ,Riverside,,40,8/28/16 15:23,8/29/16 15:00,33.61448606,-116.2973936,,,,,,,,,,,91,106,75,52,33,50,15,1,23
Gap Fire Incident Information: ,Siskiyou,,33867,8/27/16 18:00,8/28/16 18:15,40.07372516,-122.5482046,,,,,,,,,,,75,91,61,54,49,81,13,1,24
Havilah Fire Incident Information: ,Kern,,304,8/28/16 18:50,8/28/16 18:50,35.6180087,-118.473141,,,,,,,,,,,81,93,66,54,42,59,24,1,21
Mokelumne Fire Incident Information: ,Alpine,,,8/18/16 12:05,8/30/16 12:05,38.5832424,-119.9796281,,,,,,,,,,,63,86,43,30,32,65,12,1,16
Bogart Fire Incident Information: ,Riverside,,1470,8/30/16 12:25,9/2/16 18:10,33.62092014,-117.3254739,1,1,,,,,,,,,81,99,64,63,61,87,27,1,26
Mina Fire Incident Information: ,Mendocino,,36,8/30/16 13:35,8/31/16 07:15,39.25166926,-123.5307906,,,,,,,,,,,73,88,57,48,52,80,24,1,24
Willow Fire Incident Information: ,Amador,,19,8/30/16 16:52,8/31/16 07:05,38.6799757,-120.91888,,,,,,,,,,,73,88,63,45,33,52,19,1,19
Mockingbird Fire Incident Information: ,Lake,,20,8/30/16 16:54,8/31/16 07:05,39.1408901,-122.912735,,,,,,,,,,,73,88,57,48,52,80,24,1,24
Holy Fire Incident Information: ,Orange,,150,8/31/16 04:10,9/5/16 06:55,33.6768601,-117.5174896,,,,,,,,,,,79,97,61,63,64,90,32,1,27
Oak Fire Incident Information: ,Santa Clara,,25,9/1/16 14:36,9/2/16 06:55,37.09980587,-121.4398836,,,,,,,,,,,64,79,52,55,84,100,47,1,34
Sunny Fire Incident Information: ,Fresno,,158,9/3/16 14:44,9/6/16 18:15,36.72811422,-119.9173569,,,,,,,,,,,75,90,61,43,34,60,7,1,32
Ken Fire Incident Information: ,San Bernardino,,20,9/3/16 21:51,9/4/16 18:55,34.3117,-117.475,,,,,,,,,,,68,81,55,57,75,94,45,1,26
Saddle Fire Incident Information: ,Butte,,850,9/5/16 16:28,9/12/16 14:51,36.821734,-118.3392848,3,3,,,2,3,133,4,,2,68,84,52,25,24,38,10,1,23
Spring Fire Incident Information: ,San Bernardino,,50,9/7/16 16:53,9/9/16 06:00,34.3117,-117.475,,,,,,,,,,,68,84,54,59,75,93,52,1,32
Phoenix Fire Incident Information: ,Nevada,,38,9/7/16 15:09,12/31/69 16:00,38.37991864,-121.7203386,,,,,,,,,,,73,95,50,54,60,96,24,1,23
Ruff Fire  Incident Information: ,Mendocino,,50,9/10/16 14:06,9/15/16 09:10,39.7217616,-123.5020005,,,,,,,,,,,,63,55,,,,,1,0
Lake Fire Incident Information: ,Shasta,,75,9/10/16 15:45,9/12/16 19:00,40.680027,-122.3558429,,,,,,,,,,,,88,59,,,,,1,0
Boys Fire Incident Information: ,Sacramento,,40,9/11/16 11:25,9/12/16 19:00,38.5290306,-121.3350068,,,,,,,,,,,72,82,63,46,41,56,26,1,19
Willard Fire Incident Information: ,Lassen,,2575,9/11/16 11:33,9/22/16 07:00,41.09746791,-119.178496,1,7,,,2,2,78,3,,2,,,,,,,,1,0
Howard Fire Incident Information: ,Modoc,,380,9/11/16 14:15,9/14/16 18:00,41.4854446,-120.9699697,,,,,,,,,,,63,84,37,28,36,57,14,1,35
Moffett Fire Incident Information: ,Siskiyou,,32,9/12/16 16:28,9/13/16 18:30,41.6279294,-122.8101695,,,,,,,,,,,61,73,46,30,35,58,18,1,23
Hog Fire Incident Information: ,Tehama,,360,9/13/16 23:10,9/13/16 14:30,40.43988909,-122.466557,,,,5,2,12,168,6,2,5,,88,57,,,,,1,0
Old Fire Incident Information: ,Del Norte,,150,9/13/16 13:55,9/17/16 18:00,41.69912253,-123.8485756,,,,,,,,,,,63,73,52,46,76,100,23,1,21
Old Fire Incident Information: ,Butte,,30,9/16/16 23:28,9/19/16 18:30,37.83596589,-120.9913088,,,,,,,,,,,73,93,55,48,52,68,20,1,19
Auburn Fire Incident Information: ,Nevada,,47,9/17/16 13:40,9/20/16 18:00,39.05131087,-120.693801,,,,,,,,,,,79,91,64,37,26,37,16,1,14
Owens River Fire Incident Information: ,Inyo,,5443,9/17/16 13:49,9/18/16 08:10,36.72497874,-118.5542092,,,,,,,,,,,,,,,,,,1,0
Soup Complex Incident Information: ,Modoc,,2652,9/17/16 14:37,10/13/16 11:30,41.3088889,-120.2783333,,,,,,,,,,,61,84,37,28,34,65,12,1,21
Canyon Fire Incident Information: ,Santa Barbara,,12518,9/17/16 17:20,9/27/16 14:00,34.37242967,-119.4683654,,,,,,,,,,,66,79,55,57,77,90,52,1,16
Flat Fire Incident Information: ,Kern,,306,9/19/16 14:13,9/21/16 09:30,35.46787766,-118.5730131,,,,,,,,,,,88,106,70,41,23,35,11,1,29
Bangor Fire Incident Information: ,Butte,,130,9/22/16 11:45,9/23/16 10:30,34.08409644,-119.9050057,,,,,,,,,,,61,73,46,,,,,1,35
Washington Fire Incident Information: ,Santa Barbara,,215,9/22/16 14:20,9/27/16 14:00,33.6878226,-120.0514122,,,,,,,,,,,,,,,,,,1,0
Butte Fire Incident Information: ,Sutter,,300,9/20/16 09:30,9/20/16 18:00,39.1214733,-121.6111047,,,,,,,,,,,75,88,66,37,24,37,14,1,19
Bell Fire Incident Information: ,Amador,,45,9/23/16 13:12,9/25/16 17:45,38.5389755,-120.8474206,,,,4,2,18,150,5,2,3,64,77,50,36,38,67,18,1,16
Newmark Fire Incident Information: ,Fresno,,70,9/23/16 12:40,9/24/16 20:00,36.61755424,-119.7651644,,,,,,,,,,,66,81,52,39,46,71,21,1,21
Cow Fire Incident Information: ,Shasta,,100,9/25/16 07:15,9/25/16 13:15,40.41658651,-119.2168969,,,,,,,,,,,,,,,,,,1,0
Sawmill Fire Incident Information: ,Sonoma,,1547,9/25/16 10:43,9/29/16 17:00,38.29435833,-122.6599221,2,,,,,3,14,,,,73,99,48,46,53,93,13,1,26
Marshes Fire Incident Information: ,Tuolumne,,1080,9/26/16 12:20,10/4/16 22:00,37.7407411,-120.3786904,,,,,,2,92,2,,,79,100,55,45,37,62,12,1,19
Tobin Fire Incident Information: ,Plumas,,248,9/26/16 13:23,10/6/16 17:15,40.16345511,-120.5422075,,,,,,,,,,,,72,37,,,,,1,0
Loma Fire Incident Information: ,Santa Clara,,4474,9/26/16 14:42,9/19/17 10:30,37.15176776,-121.3389856,,29,,,1,3,62,1,,5,79,102,54,41,34,67,9,1,24
Creek Fire Incident Information: ,Napa,,65,10/10/16 16:13,10/12/16 18:00,38.3752337,-122.390517,,,,,0,5,86,4,,2,57,72,45,48,77,100,53,1,27
Sacata Fire Incident Information: ,Fresno,,2100,10/11/16 12:58,10/20/16 07:00,36.71829633,-120.3318308,,,,,,,,,,,70,82,55,46,51,72,30,1,19
Emerald Fire Incident Information: ,El Dorado,,176,10/14/16 01:28,10/17/16 11:45,38.6613934,-120.6452318,,,,,,,,,,,57,61,55,55,91,100,72,1,27
Gopher Fire Incident Information: ,San Diego,,28,11/13/16 11:14,11/14/16 18:00,33.2501489,-117.1540909,,,,,,,,,,,70,81,61,45,40,48,27,1,14
Marek Fire Incident Information: ,Los Angeles,,4824,11/14/16 05:45,11/14/16 14:00,34.33926988,-118.4809489,,,,,,,,,,,,70,46,,,,,1,0
Jacobson Fire Incident Information: ,Tulare,,,10/20/16 17:00,12/19/16 13:30,36.3127167,-118.3220313,,,,,,,,,,,,,,,,,,1,0
Meadow Fire Incident Information: ,Tulare,,4347,10/29/16 11:15,12/19/16 13:30,34.94224701,-118.4405007,,,,,,,,,,,61,79,46,46,59,83,32,1,19
Oroville Spillway  Incident Information: ,Butte,,,2/7/17 14:00,3/9/17 11:00,39.5380318,-121.4832601,,,,,,,596,,,,55,63,52,54,91,100,82,1,58
Grace Fire Incident Information: ,Shasta,,45,4/3/17 16:00,9/19/17 20:01,37.20411439,-119.964706,,,,,,,,,,,64,75,52,43,57,93,21,1,32
West Fire Incident Information: ,Modoc,,380,4/3/17 16:00,9/19/17 20:01,36.59372277,-120.3008754,,,,,,,,,,,64,75,52,43,57,93,21,1,32
66 Fire Incident Information: ,Riverside,,15,4/13/17 02:30,9/19/17 22:08,33.54771165,-116.1919827,,,,,,,,,,,70,75,63,46,47,60,33,1,27
Jayne Fire Incident Information: ,Fresno,,5738,4/20/17 15:40,9/19/17 20:01,36.0359387,-120.1817642,,,0,,,,,,,,64,75,52,45,57,83,31,1,35
Soledad Fire Incident Information: ,Monterey,,8,4/24/17 12:06,9/19/17 20:01,36.4358187,-121.342395,,,,,,,,,,,55,63,48,48,79,93,59,1,23
El Dorado Fire Incident Information: ,Fresno,,976,4/28/17 15:40,9/21/17 21:17,36.78823805,-119.5229124,,,,,,,,,,,64,75,52,37,45,77,13,1,47
Tumey Fire Incident Information: ,Fresno,,126,4/29/17 17:15,9/19/17 20:01,36.94897144,-120.1072632,,,,,,,,,,,64,81,48,37,44,71,17,1,21
Opera Fire Incident Information: ,Riverside,,1350,4/30/17 15:23,9/19/17 20:05,33.52837947,-117.4165239,,,,,,,,,,,64,88,43,34,36,74,12,1,23
Tower Fire Incident Information: ,San Bernardino,,150,4/30/17 16:03,9/19/17 20:05,37.06963698,-121.4218302,,,,,,,,,,,63,84,43,45,54,87,22,1,32
Jameson Fire Incident Information: ,Riverside,,12,4/30/17 19:43,9/19/17 20:05,33.7833445,-117.5050634,,,,,,,,,,,64,88,43,34,36,74,12,1,23
Fay Fire Incident Information: ,Kern,,19,5/1/17 12:44,9/19/17 20:05,35.7076057,-118.3025001,,,,,,,,,,,,82,46,,,,,1,0
Olive Fire Incident Information: ,San Luis Obispo,,130,5/2/17 14:32,9/19/17 20:05,35.7238099,-120.2964285,,,,,,,,,,,73,97,50,46,48,77,19,1,23
Shandon Fire Incident Information: ,San Luis Obispo,,12,5/7/17 16:41,9/19/17 20:05,35.55108515,-120.370632,,,,,,,,,,,57,66,48,46,75,93,56,1,32
Sonoma Fire Incident Information: ,Fresno,,400,5/10/17 15:27,9/19/17 20:06,36.86966751,-120.1608152,,,,,,,,,,,72,84,59,52,57,80,34,1,29
Hub Fire Incident Information: ,Kern,,31,5/12/17 05:05,9/19/17 20:06,35.600435,-118.46833,,,,,,,,,,,61,66,52,45,55,72,37,1,34
Wright Fire Incident Information: ,Merced,,1800,5/12/17 15:30,9/19/17 20:06,37.3214687,-120.8478717,,,,,,,,,,,63,72,52,39,50,77,23,1,35
Nacimiento Fire Incident Information: ,Monterey,,20,5/14/17 12:00,9/19/17 20:06,35.24091931,-121.0667804,,,,,,,,,,,,54,46,,,,,1,0
Canyon Fire Incident Information: ,Riverside,,17,5/14/17 12:51,9/19/17 20:12,33.8838439,-116.9967943,,,,,,,,,,,55,73,39,45,64,89,43,1,29
Feed Fire Incident Information: ,Kern,,41,5/14/17 14:00,9/19/17 20:12,35.0454201,-118.9176093,,,,,,,,,,,61,75,45,36,43,65,21,1,29
Arrow Fire Incident Information: ,San Luis Obispo,,225,5/15/17 13:58,9/19/17 20:12,35.227468,-119.8901979,,,,,,,,,,,54,63,46,46,78,100,55,1,39
Bravo Fire Incident Information: ,Kern,,288,5/15/17 14:05,9/19/17 22:08,35.6508657,-119.0426995,,,,,,,,,,,64,75,55,39,41,55,27,1,27
Pine Fire Incident Information: ,Monterey,,18,5/16/17 16:10,9/19/17 20:12,36.1657725,-120.8699158,,,,,,,,,,,61,73,45,43,59,92,25,1,39
Lonoak Fire Incident Information: ,Monterey,,17,5/17/17 15:18,9/19/17 20:12,35.71951163,-121.138916,,,,,,,,,,,,54,46,,,,,1,0
41 Fire Incident Information: ,Madera,,150,5/17/17 15:30,5/17/17 06:45,36.9094631,-119.7936103,,,,,,,,,,,66,77,54,43,51,83,19,1,34
Camp Fire Incident Information: ,San Luis Obispo,,225,5/18/17 08:48,9/19/17 20:12,35.348184,-120.768757,,,,,,,,,,,,54,46,,,,,1,0
Elm Fire Incident Information: ,Fresno,,10343,5/18/17 13:11,9/19/17 20:12,36.1219631,-120.3743231,,,,,,35,432,14,2,,64,84,46,34,34,63,12,1,32
City Fire Incident Information: ,Kings,,20,5/18/17 12:54,9/19/17 20:13,35.983584,-119.9595823,,,,,,,,,,,64,82,46,45,58,93,22,1,16
Moraga Fire Incident Information: ,Riverside,,14,5/18/17 17:25,9/19/17 20:18,33.70136161,-117.8320522,,,,,,,,,,,61,81,41,46,78,100,38,1,29
Manning Fire Incident Information: ,Fresno,,70,5/19/17 23:28,9/19/17 20:18,36.09293577,-119.7712379,,,,,,,,,,,72,90,54,43,37,69,18,1,19
Taglio Fire Incident Information: ,Merced,,12,12/31/69 16:00,5/19/17 16:00,37.22507703,-120.7340802,,,,,,,,,,,43,55,28,,,,,1,0
Range Fire Incident Information: ,San Luis Obispo,,,5/19/17 13:10,5/19/17 14:40,35.7986114,-120.74353,,,,,,,,,,,,54,46,,,,,1,0
Deluz Fire Incident Information: ,San Diego,,486,5/19/17 14:45,5/26/17 11:40,33.2295467,-117.3811366,,,,,,,,,,,66,79,57,52,58,93,31,1,16
Gate Fire Incident Information: ,San Diego,,2056,5/20/17 23:19,5/26/17 09:35,32.654836,-116.8070557,,,,,,,665,,,,63,84,41,32,41,70,12,1,37
Rocky Fire Incident Information: ,San Luis Obispo,,17,5/20/17 13:11,9/19/17 20:18,35.47296964,-120.1478635,,,,,,,,,,,72,97,46,37,44,76,11,1,24
Ming Fire Incident Information: ,Kern,,506,5/20/17 14:23,9/19/17 20:18,34.27975931,-117.6437741,,,,,,,,,,,72,97,46,39,37,83,10,1,24
Wasioja Fire Incident Information: ,Santa Barbara,,190,5/20/17 17:54,5/21/17 21:10,34.984338,-119.7828103,,,,,,,,,,,72,93,50,41,42,82,15,1,24
Smiley Fire Incident Information: ,Riverside,,35,5/21/17 16:12,5/21/17 22:10,33.39947416,-116.5960155,,,,,,,,,,,75,93,57,43,34,52,12,1,29
Bitterwater Fire Incident Information: ,San Benito,,21,5/22/17 04:50,9/19/17 20:20,36.73550159,-121.188522,,,,,,,,,,,66,84,48,50,72,100,29,1,29
Moreno Fire Incident Information: ,Riverside,,10,5/23/17 13:13,5/23/17 18:30,33.9463816,-117.1785135,,,,,,,,,,,70,88,54,55,63,96,33,1,29
Ribbonwood Fire Incident Information: ,San Diego,,25,5/24/17 15:30,5/25/17 18:45,32.61161353,-121.5139183,,,,,,,,,,,,,,,,,,1,0
Lamb Fire Incident Information: ,Riverside,,120,5/25/17 14:48,5/26/17 07:15,33.8838439,-116.9967943,,,,,,,,,,,64,70,59,50,64,81,51,1,24
Range Fire Incident Information: ,San Diego,,1000,5/25/17 18:15,5/26/17 11:35,38.76733293,-119.8301091,,,,,,,,,,,57,68,48,25,28,41,20,1,34
Champagne Fire Incident Information: ,Kern,,10,5/28/17 10:59,9/19/17 20:20,34.8664079,-118.3905425,,,,,,,,,,,,77,54,,,,,1,0
Rusty Fire Incident Information: ,Fresno,,16,5/28/17 07:49,9/19/17 20:20,36.23356666,-119.8885105,,,,,,,,,,,75,90,61,54,52,78,26,1,21
Serenas Fire Incident Information: ,Riverside,,48,5/28/17 15:27,5/28/17 21:00,33.583958,-116.075037,,,,,,,,,,,84,106,64,39,32,58,5,1,34
Lombardi Fire Incident Information: ,Calaveras,,15,5/28/17 15:30,5/28/17 22:50,37.0343894,-117.5139216,,,,,,,,,,,,,,,,,,1,0
Panoche Fire Incident Information: ,Fresno,,18,5/28/17 16:16,5/28/17 22:50,36.16909417,-120.458649,,,,,,,,,,,73,90,57,48,43,72,21,1,23
Matz Fire Incident Information: ,San Bernardino,,16,5/29/17 01:20,9/19/17 20:23,34.0503149,-116.5701231,,,,,,,,,,,,75,50,,,,,1,0
Twenty Fire Incident Information: ,Yuba,,3,5/29/17 15:31,5/29/17 21:15,39.2303382,-121.3739103,,,,,,,,,,,73,86,63,57,60,83,37,1,14
Fountain Fire  Incident Information: ,Tulare,,79,5/31/17 11:30,9/19/17 20:23,35.891654,-119.0001451,,,,,,,,,,,72,79,64,46,47,63,31,1,24
Clay Fire Incident Information: ,Sacramento,,68,6/1/17 15:38,9/19/17 20:23,38.5290306,-121.3350068,,,,,,,,,,,70,81,61,57,65,88,39,1,16
