fire_name,county,cost,burnt_acres,startDate,finishDate,latitude,longitude,injuries,destroyedStructures,threatenedStructures,airtankers,dozers,fireEngines,firePersonnel,fireCrews,helicopters,waterTenders,meanTemp,maxTemp,minTemp,dewPoint,avgHumidity,maxHumidity,minHumidity,fire,maxWind
Sharp Fire Incident Information: ,San Bernardino,,243,8/8/13 12:15,8/13/13 23:45,35.68480732,-118.6132129,,,,,,,,,,,79,91,64,48,42,67,16,1,23
Coyote Fire Incident Information: ,Lassen,,97,8/9/13 15:51,8/12/13 09:30,34.81296717,-120.59268,,,,,,,,,,,66,79,55,52,69,88,36,1,26
American Fire Incident Information: ,Placer,,27440,8/10/13 16:30,8/30/13 08:00,39.1021234,-120.6707629,,,,,,,,,,,72,84,61,48,47,64,29,1,16
Bee Fire Incident Information: ,Los Angeles,,100,8/9/13 17:15,8/11/13 19:15,34.5361733,-118.5272372,,,,,,,,,,,,90,63,,,,,1,0
Corral Complex Incident Information: ,Humboldt,,12503,8/10/13 11:40,8/12/13 12:00,41.0399112,-123.5537328,,,,,,,,,,,55,63,52,54,93,100,77,1,13
Cloverdale Fire Incident Information: ,Shasta,,27,8/14/13 15:37,8/14/13 20:35,37.59551727,-122.5687245,,,,,,,,,,,75,90,59,52,51,78,23,1,26
Cottonwood Fire Incident Information: ,Siskiyou,,50,8/15/13 14:40,8/15/13 17:00,41.931354,-122.5880926,,,,,,,,,,,75,93,57,50,44,64,24,1,27
Union Fire Incident Information: ,El Dorado,,116,8/16/13 13:55,8/16/13 17:55,37.49815032,-120.8563126,,1,,,,,,,,,86,100,70,57,43,68,18,1,24
Swedes Fire Incident Information: ,Butte,,2462,8/16/13 16:37,8/22/13 18:00,39.5137752,-121.556359,5,8,,,4,15,479,14,9,6,81,97,64,55,48,82,19,1,19
Pierce Fire Incident Information: ,Riverside,,40,8/16/13 13:31,8/16/13 21:00,33.5693261,-116.1125097,,,,,,,,,,,99,115,82,52,26,40,12,1,26
Double Fire Incident Information: ,Lake,,70,8/16/13 17:57,8/18/13 18:30,39.0161541,-122.4903565,,,,,4,10,,2,,5,73,91,55,57,65,100,29,1,26
Bridges Fire Incident Information: ,Calaveras,,46,8/17/13 10:11,8/19/13 07:10,38.05335,-120.4346451,2,,,,5,5,68,3,3,2,79,97,63,43,32,56,11,1,21
Cleghorn Fire Incident Information: ,San Bernardino,,110,8/17/13 17:25,8/18/13 20:55,34.3117,-117.475,,,,,,,,,,,73,93,57,55,53,87,24,1,27
Plumas Lightning Complex (Hough) Incident Information: ,Plumas,,513,8/18/13 18:30,8/25/13 13:15,40.14769375,-120.4358995,,,,,,,,,,,,84,46,,,,,1,0
Shirley Fire Incident Information: ,Kern,,794,8/18/13 23:12,8/24/13 13:45,35.18317804,-116.2629569,,,,,,,,,,,88,97,81,43,20,24,16,1,34
Burney Lightning Series (Warner Fire) Incident Information: ,Shasta,,7,8/19/13 17:48,8/23/13 19:15,41.0038009,-121.4388043,,,,,1,10,225,3,4,7,,,,,,,,1,0
Gobblers Fire Incident Information: ,San Bernardino,,413,8/20/13 13:32,8/20/13 13:32,34.20135,-117.448046,,,,,,,,,,,75,90,61,61,65,100,35,1,24
Deer Fire Incident Information: ,Tehama,,11429,8/23/13 14:15,8/29/13 16:45,40.0180002,-121.8324867,5,,,,3,36,898,30,5,8,73,90,61,52,49,72,22,1,13
Fish Fire Incident Information: ,Tulare,,2060,8/24/13 14:31,9/24/13 20:15,36.3127167,-118.3220313,,,,,,,,,,,,,,,,,,1,0
Empire Fire Incident Information: ,El Dorado,,38,8/24/13 14:54,8/24/13 11:45,38.02323765,-119.6250555,,,,,,,,,,,54,75,32,25,36,69,12,1,26
Little Fire Incident Information: ,San Bernardino,,97,8/24/13 15:09,8/30/13 08:00,34.60448278,-117.492849,,,,,,,,,,,77,97,57,30,24,56,5,1,29
Tyler Fire Incident Information: ,Nevada,,52,8/31/13 14:42,8/31/13 21:30,39.3532749,-121.065207,,,,,,,,,,,81,93,70,45,29,40,17,1,16
Centerville Fire Incident Information: ,Butte,,80,8/31/13 17:23,9/1/13 18:00,39.3727318,-117.3104045,1,,,,,10,35,2,,,,72,55,,,,,1,0
Davis Creek Complex Incident Information: ,Modoc,,97,9/5/13 15:57,9/24/13 20:15,41.68197127,-119.448221,,,,,,,,,,,,,,,,,,1,0
Rail Fire Incident Information: ,Modoc,,68,9/7/13 17:30,9/5/13 21:00,37.77061448,-119.6478836,,,,,,,,,,,,,,,,,,1,0
Rim Fire Incident Information: ,Tuolumne,,257314,8/17/13 15:25,9/6/13 18:30,37.8371052,-120.2340086,,,,,,,,,,,82,99,66,52,43,53,18,1,24
Chestnut Fire Incident Information: ,San Mateo,,41,9/7/13 13:55,9/7/13 20:00,37.6557484,-122.4322691,,,,,,,,,,,73,97,48,52,50,84,16,1,26
Morgan Fire Incident Information: ,Contra Costa,,3111,9/8/13 13:08,9/14/13 17:30,37.78902846,-121.996483,,,,,5,3,231,8,,4,68,86,50,55,69,100,37,1,19
Angora Fire Incident Information: ,Tulare,,134,9/8/13 11:53,9/24/13 20:15,36.3127167,-118.3220313,,,,,,,,,,,,,,,,,,1,0
Clover Fire Incident Information: ,Shasta,,8073,9/9/13 12:32,9/15/13 07:30,40.497836,-122.5444661,6,211,,,3,30,342,12,,,72,95,50,39,39,71,12,1,13
Lyon Fire Incident Information: ,San Diego,,263,9/9/13 13:09,9/12/13 18:15,33.76318486,-119.2728864,2,,176,2,,15,294,4,1,4,66,72,61,57,78,90,66,1,21
Liveoak Fire Incident Information: ,San Bernardino,,73,9/11/13 16:57,9/12/13 08:45,34.013025,-117.100065,,,,,,,,,,,68,82,54,57,73,100,44,1,24
Tehama Fire Incident Information: ,Tehama,,75,9/15/13 17:39,9/15/13 19:00,40.0212683,-122.1002666,,,,,,,,,,,73,86,61,50,48,72,20,1,37
Lakeshore Fire Incident Information: ,Lake,,30,9/15/13 19:45,9/15/13 17:14,39.34174194,-122.7619695,,,,,,,,,,,70,84,54,52,56,80,32,1,24
Creek Fire Incident Information: ,San Luis Obispo,,94,9/24/13 03:20,9/24/13 17:30,35.28930733,-120.3719024,,,,,,,,,,,70,90,48,46,48,77,18,1,32
Madre Fire Incident Information: ,Los Angeles,,268,9/23/13 18:00,9/28/13 08:00,34.2376776,-117.859767,,,,,,,,,,,70,95,45,45,48,93,16,1,21
Sierra Fire Incident Information: ,San Bernardino,,200,9/24/13 15:51,9/30/13 08:30,34.3117,-117.475,,,,,,,,,,,68,90,46,45,47,86,19,1,24
Valley Fire Incident Information: ,San Diego,,40,9/26/13 17:29,9/28/13 09:15,32.8277006,-116.9024517,,,,,,,,,,,66,72,63,54,62,70,50,1,19
Highland Fire Incident Information: ,Mendocino,,98,9/28/13 13:57,9/29/13 18:15,39.22912563,-123.6523414,,,,,,,,,,,64,82,45,45,53,83,23,1,21
Putah Fire Incident Information: ,Napa,,376,10/3/13 20:33,10/4/13 16:55,38.5516204,-122.2314164,,,,,,1,4,,,,59,77,39,32,50,86,14,1,48
Highland Fire Incident Information: ,Alameda,,150,10/4/13 07:35,10/4/13 10:30,37.69935094,-121.8537526,,,,,,,,,,,68,81,55,28,24,36,11,1,39
Crane Fire Incident Information: ,Sonoma,,159,10/4/13 12:25,10/5/13 07:45,38.3440623,-122.6444407,,,,,,,,,,,70,84,54,25,26,41,10,1,60
Summit Fire Incident Information: ,Butte,,305,10/4/13 17:37,10/5/13 22:00,34.8791085,-118.8007896,,4,,,1,15,259,4,1,3,,81,55,,,,,1,0
DeLuz Fire Incident Information: ,San Diego,,2236,10/5/13 12:45,10/9/13 19:00,34.44791649,-122.7409536,,,,,,,,,,,,,,,,,,1,0
Baker Fire Incident Information: ,Orange,,40,10/6/13 10:52,10/9/13 08:00,33.62657555,-117.6702585,,,,,,,,,,,70,95,43,23,22,54,4,1,16
Capay Fire Incident Information: ,Yolo,,163,11/4/13 11:41,11/4/13 15:35,35.32290543,-119.0699738,,,,,,,,,,,55,64,46,30,44,61,27,1,13
Dersch Fire Incident Information: ,Shasta,,33,11/7/13 16:10,11/7/13 19:45,38.30648771,-121.1441638,,,,,,,,,,,63,75,48,37,46,66,24,1,13
Toro Fire Incident Information: ,San Luis Obispo,,51,11/8/13 10:30,11/9/13 17:00,35.451152,-120.810684,,,,4,3,15,219,5,2,,,57,50,,,,,1,0
Cantwell Fire Incident Information: ,Lake,,120,11/8/13 13:42,11/10/13 18:30,38.98621586,-123.2936294,,1,,,6,30,285,10,,3,57,73,41,43,64,96,31,1,16
Wheeler Fire Incident Information: ,Ventura,,64,11/14/13 11:05,11/15/13 16:00,34.365122,-119.1490845,,,,,,,,,,,,70,46,,,,,1,0
Silverado Fire Incident Information: ,Napa,,190,11/21/13 21:39,11/23/13 18:30,38.357363,-122.2873083,,1,,,,15,150,6,,3,57,64,52,34,57,96,17,1,53
McCabe Fire Incident Information: ,Sonoma,,3505,11/22/13 02:04,11/27/13 18:15,38.7749061,-122.7552692,6,1,,,,5,188,8,,,63,73,54,9,12,20,8,1,52
Retek Fire Incident Information: ,Mendocino,,82,11/22/13 10:06,11/22/13 17:30,39.64224885,-123.2028703,,,,,,,,,,,63,77,46,0,10,16,3,1,32
Bruner Fire Incident Information: ,Lake,,50,11/23/13 12:04,11/24/13 08:45,39.06286072,-122.6350091,,,,,,,,,,,54,73,34,21,37,64,9,1,19
Dam Fire Incident Information: ,Lake,,23,11/23/13 14:17,11/24/13 18:45,38.931281,-122.616352,,,,,,,,,,,54,70,37,23,41,70,11,1,32
Happy Camp Fire Incident Information: ,Ventura,,44,12/10/13 02:26,12/11/13 17:30,34.3343898,-118.865506,,,,,,,,,,,,64,43,,,,,1,0
Pfeiffer Fire Incident Information: ,Monterey,,917,12/16/13 00:20,12/20/13 20:00,36.240921,-121.7780601,,,,,,,,,,,57,75,39,30,42,65,18,1,13
Refuse Fire Incident Information: ,Mendocino,,15,12/30/13 11:00,12/30/13 20:30,39.30174933,-123.1050902,,,,,,,,,,,46,68,27,25,49,78,19,1,14
Grant Fire Incident Information: ,Santa Clara,,40,12/31/13 05:30,12/31/13 16:00,37.341465,-121.719671,,,,,,,,,,,50,68,32,27,51,70,23,1,26
Honcut Fire Incident Information: ,Butte,,60,1/1/14 10:46,1/2/14 07:30,38.24489186,-119.0765877,,,,,,,,,,,36,57,14,12,55,77,18,1,0
Campbell Fire Incident Information: ,Tehama,,865,1/2/14 20:00,1/10/14 18:30,40.55585703,-121.845189,,,,,,,,,,,54,72,36,32,53,76,17,1,16
Bridge Fire Incident Information: ,Humboldt,,18,1/3/14 10:30,1/4/14 18:30,40.471147,-123.797608,,,,,,,,,,,43,48,37,43,94,100,83,1,10
Red Fire Incident Information: ,Humboldt,,333,1/4/14 12:00,1/8/14 19:15,40.8959657,-123.7711671,,,,,,,,,,,45,55,36,37,85,100,28,1,11
Colby Fire Incident Information: ,Los Angeles,,1952,1/16/14 05:50,1/27/14 10:00,34.1919041,-117.8619123,,,,,,,,,,,73,84,61,1,7,13,4,1,37
Brewer Fire Incident Information: ,Placer,,120,1/22/14 13:10,1/22/14 16:35,35.6747922,-118.8226101,,,,,,,,,,,55,68,43,30,43,62,24,1,13
Lake Fire Incident Information: ,Fresno,,106,1/25/14 06:37,1/26/14 18:00,36.856862,-119.338145,,,,,,,,,,,61,75,45,27,35,56,14,1,11
Gun Fire Incident Information: ,San Diego,,125,3/8/14 12:30,3/11/14 11:00,32.9058923,-116.4574975,,,,,,,,,,,59,72,46,18,20,28,11,1,56
Pierce Fire Incident Information: ,Riverside,,350,3/15/14 16:37,3/16/14 08:30,33.5693261,-116.1125097,,,,,,,,,,,73,90,57,23,28,51,5,1,34
Encinal Fire Incident Information: ,Monterey,,400,3/19/14 16:45,3/21/14 18:00,36.01156344,-120.9448514,,,,,,,,,,,,54,46,,,,,1,0
Van Buren Fire Incident Information: ,Riverside,,57,3/28/14 14:31,3/29/14 17:15,33.97354391,-117.03023,,,,,,,,,,,55,72,39,45,67,93,38,1,23
Bridges Fire Incident Information: ,Inyo,,113,4/19/14 15:54,4/21/14 19:15,37.56538879,-118.4629313,,,,,1,12,256,11,2,,61,81,41,34,43,70,16,1,47
Etiwanda Fire Incident Information: ,San Bernardino,,2143,4/30/14 08:00,5/5/14 17:30,34.1063989,-117.5931084,3,1,0,,,25,583,22,,8,73,88,61,16,12,25,4,1,50
San Lucas Fire Incident Information: ,Monterey,,75,4/30/14 14:25,5/1/14 19:00,36.1150412,-121.1287569,,,,,,,,,,,,54,46,,,,,1,0
Jacumba Fire Incident Information: ,San Diego,,29,5/5/14 16:36,5/6/14 10:20,32.6848178,-116.2695461,,,,,,,,,,,54,73,34,34,43,70,16,1,37
Bernardo Fire Incident Information: ,San Diego,,1548,5/13/14 11:00,5/17/14 20:14,35.66609489,-117.3460931,3,,50,,,,211,4,,,,86,50,,,,,1,0
Miguelito Fire Incident Information: ,Santa Barbara,,632,5/13/14 14:00,5/19/14 09:20,34.92187194,-120.2810503,,,1200,,1,10,548,10,1,3,70,93,46,27,24,54,7,1,34
Highway Fire Incident Information: ,San Diego,,380,5/14/14 13:00,5/15/14 18:30,33.198374,-117.1236502,,,,,,,,,,,84,100,70,19,11,22,4,1,34
Tomahawk Fire Incident Information: ,San Diego,,5367,5/14/14 09:45,5/19/14 09:20,33.3700162,-117.2598064,,,,,,,,,,,84,100,70,19,11,22,4,1,34
Fiddler Fire Incident Information: ,Shasta,,50,5/14/14 14:00,5/15/14 11:30,37.43101468,-123.1578823,,,,,,,,,,,66,77,54,46,46,68,24,1,26
Cocos Fire Incident Information: ,San Diego,,1995,5/14/14 16:00,5/22/14 18:15,33.1187672,-117.1646914,3,40,,,1,21,514,13,,2,84,100,70,19,11,22,4,1,34
Freeway Fire  Incident Information: ,San Diego,,56,5/14/14 17:43,5/20/14 11:30,33.3700162,-117.2598064,,,,,,,,,,,84,100,70,19,11,22,4,1,34
River Fire Incident Information: ,San Diego,,105,5/14/14 12:12,5/19/14 09:20,33.2508495,-117.3001559,,,,,,,,,,,84,100,70,19,11,22,4,1,34
Pulgas Fire Incident Information: ,San Diego,,14416,5/15/14 14:45,5/21/14 17:00,33.53936871,-118.6843786,,,,,,,,,,,86,93,81,12,7,10,5,1,21
Poinsettia Fire Incident Information: ,San Diego,,600,5/14/14 10:30,5/17/14 00:00,33.1164669,-117.2633876,,,,,,,,,,,84,100,70,19,11,22,4,1,34
San Mateo Fire Incident Information: ,San Diego,,1457,5/16/14 11:24,5/20/14 23:30,33.4531424,-117.5631094,,,,,,,,,,,73,99,48,37,32,66,8,1,23
Indian Fire Incident Information: ,Lake,,175,5/25/14 12:20,5/26/14 08:45,39.0262841,-122.6719304,,,,,,,,,,,73,97,48,45,51,86,15,1,37
Hunters Fire Incident Information: ,Mariposa,,677,5/26/14 15:33,6/2/14 18:30,38.39857866,-120.2969855,9,3,,,,2,32,2,,,72,91,54,46,47,82,17,1,16
Lake Fire Incident Information: ,Stanislaus,,37,5/27/14 11:23,5/29/14 08:45,37.6483904,-120.4921857,,,,,,,,,,,73,93,54,34,31,51,10,1,35
59 Fire Incident Information: ,Tuolumne,,487,6/4/14 11:45,6/5/14 20:00,37.7354426,-120.3839017,,,,,,,,,,,77,95,57,46,42,67,17,1,24
Santa Fire Incident Information: ,Riverside,,14,6/4/14 15:18,6/4/14 16:30,33.5433496,-117.2694553,,,,,,,,,,,66,86,46,48,51,86,24,1,24
Hetch Hetchy Fire Incident Information: ,Tuolumne,,269,6/5/14 13:04,6/6/14 09:30,37.7346199,-120.209833,,,,,,,,,,,79,99,61,45,34,52,15,1,26
Bogart Fire Incident Information: ,Riverside,,31,6/6/14 17:32,6/7/14 19:00,33.9814787,-116.9516223,,,,,,1,51,1,,,68,81,55,55,68,93,42,1,27
Valley Fire Incident Information: ,Mariposa,,90,6/6/14 17:29,6/8/14 19:45,37.79126355,-121.1468027,,,40,,5,15,356,12,4,,72,86,55,50,58,86,29,1,32
Morgan Fire Incident Information: ,Fresno,,40,6/9/14 15:15,6/11/14 07:30,36.7796672,-119.7481117,4,1,,,,,,,,,91,109,73,48,29,50,7,1,21
Haigh Fire Incident Information: ,Mariposa,,130,6/10/14 15:11,6/13/14 18:30,37.58791714,-120.3498105,1,0,,,1,,10,,,4,84,102,66,52,39,58,19,1,32
Norman Fire Incident Information: ,Solano,,70,6/12/14 14:29,6/13/14 08:00,38.18976646,-122.1373241,,,,,,,,,,,64,75,54,52,66,93,38,1,40
Tehama Fire Incident Information: ,Tehama,,225,6/13/14 12:23,6/13/14 13:50,40.0006884,-122.4580469,,,,,,,,,,,72,86,57,37,34,59,12,1,34
Stoney Fire Incident Information: ,Monterey,,4840,6/19/14 15:14,6/21/14 19:00,34.79427617,-120.9820581,,,,,,,,,,,61,72,52,50,73,88,53,1,35
Reed Fire Incident Information: ,Calaveras,,120,6/20/14 15:27,6/21/14 19:00,37.69989647,-120.9006937,,,,,,,,,,,77,99,55,43,33,53,13,1,27
Oak Fire Incident Information: ,Calaveras,,85,6/22/14 12:37,6/24/14 19:00,35.18638264,-120.9639911,1,1,,,,,,,,,,57,48,,,,,1,0
Curie Fire Incident Information: ,Santa Clara,,125,6/30/14 14:10,7/1/14 08:30,37.29649926,-121.8987177,,,,,,,,,,,70,84,55,54,64,100,35,1,37
Butts Fire Incident Information: ,Napa,,4300,7/1/14 12:08,7/9/14 18:00,38.34697174,-122.5455116,4,9,,,,,0,,,,63,72,54,55,80,93,66,1,40
Ranch Fire Incident Information: ,Kern,,70,7/1/14 18:15,7/6/14 08:30,35.7382847,-118.5573098,,,,,,,,,,,90,106,73,46,26,39,12,1,29
Modoc Lightning Complex Incident Information: ,Modoc,,1651,7/1/14 19:00,7/3/14 10:30,39.35378631,-118.8599115,,,,,,,,,,,79,102,57,28,18,39,7,1,23
West Fire Incident Information: ,Trinity,,15,7/1/14 03:45,7/3/14 10:45,40.5526961,-123.1882603,,,,,,,,,,,79,102,55,45,35,67,9,1,13
Banner Fire Incident Information: ,San Diego,,217,7/3/14 10:43,7/6/14 09:15,33.0772729,-116.5334431,4,3,,,,5,91,4,,,77,99,55,45,38,65,10,1,34
Gulch Fire Incident Information: ,Modoc,,5,7/3/14 15:46,7/7/14 07:00,37.92299977,-119.8572427,,,,,,17,427,8,2,4,63,84,43,28,28,56,7,1,27
Monticello Fire Incident Information: ,Yolo,,6488,7/4/14 21:32,7/12/14 18:00,38.6097407,-122.254045,5,,,,,2,87,,,,63,75,50,54,79,100,57,1,34
Cassel Fire Incident Information: ,Shasta,,75,7/5/14 18:44,7/8/14 18:30,37.00261946,-122.4373468,,,,,1,3,108,5,,2,55,59,54,54,91,100,82,1,21
Interlake Fire Incident Information: ,Monterey,,47,7/7/14 16:12,7/8/14 18:30,36.29761403,-120.8629122,,,,,,,,,,,,,,,,,,1,0
Hutto Fire Incident Information: ,Nevada,,38,7/7/14 16:35,7/8/14 06:56,39.1888756,-121.2703181,,,,,,,,,,,84,97,73,43,26,36,11,1,14
Dry Fire Incident Information: ,Shasta,,143,7/9/14 13:45,7/10/14 07:30,40.6387822,-122.2400385,,,,,,,,,,,81,100,63,48,39,73,12,1,11
Bible Fire Incident Information: ,El Dorado,,30,7/9/14 14:34,7/9/14 16:45,38.558943,-120.726158,,,,,,,,,,,81,91,70,52,39,53,23,1,14
Bully Fire Incident Information: ,Shasta,,12661,7/11/14 15:37,7/26/14 20:00,40.4394192,-122.6608798,21,20,0,,,,,,,,79,91,64,46,37,56,16,1,14
Nicolls Fire  Incident Information: ,Kern,,1680,7/11/14 13:46,7/21/14 14:45,35.5068876,-118.2061158,,,,,,,,,,,,100,63,,,,,1,0
Marsh Fire Incident Information: ,Contra Costa,,80,7/11/14 21:57,7/12/14 18:00,37.9895958,-122.1698918,,,,,,,,,,,66,73,59,55,72,87,57,1,35
Wildlife Fire Incident Information: ,Butte,,72,7/14/14 18:00,7/16/14 08:00,39.4980352,-121.5862129,,,,,,,,,,,88,106,72,55,37,63,17,1,24
Iowa Fire Incident Information: ,Placer,,14,7/21/14 14:49,7/22/14 18:00,38.11530837,-118.8887684,,,,,,,,,,,61,79,45,43,54,89,27,1,23
Sabina Fire Incident Information: ,Riverside,,78,7/23/14 10:47,7/24/14 09:00,33.44509441,-117.6445789,,,,,,,,,,,73,95,52,54,49,80,27,1,0
Gun Club Fire Incident Information: ,Merced,,300,7/24/14 12:06,7/25/14 09:15,37.2313875,-120.9055586,,,,,,,,,,,75,93,57,55,58,88,26,1,39
Sand Fire Incident Information: ,Amador,,4240,7/25/14 16:34,8/2/14 19:15,38.4818797,-120.8448132,2,67,,,,3,40,1,,1,81,95,66,45,29,46,14,1,14
El Portal Fire Incident Information: ,Mariposa,,4689,7/26/14 17:00,8/10/14 08:15,37.6600469,-119.8525243,,,,,,,,,,,,,,,,,,1,0
French Fire Incident Information: ,Madera,,13838,7/28/14 05:45,7/28/14 14:30,37.00472795,-120.222773,,,,,,,,,,,90,99,79,46,28,42,13,1,19
Web Fire Incident Information: ,Butte,,389,7/28/14 13:11,8/1/14 17:30,37.13784785,-120.6130798,4,,,4,5,46,835,29,1,13,84,99,70,46,35,57,13,1,14
Day Fire Incident Information: ,Modoc,,13153,7/30/14 19:01,8/13/14 07:00,34.0836998,-117.7153289,7,6,,,2,20,297,7,2,4,77,95,61,59,53,84,32,1,24
Lodge Lightning Complex Incident Information: ,Mendocino,,12536,7/30/14 06:27,9/9/14 19:30,39.53202062,-122.907856,15,,,,,,,,,,84,106,63,43,34,60,7,1,27
Siskiyou County Lightning Fires Incident Information: ,Siskiyou,,30,7/29/14 13:00,8/2/14 11:00,40.97698159,-122.1590968,,,,,,,,,,,77,99,54,45,36,66,14,1,13
Bald Fire Incident Information: ,Shasta,,39736,7/30/14 20:15,8/15/14 14:00,40.67830636,-121.6278546,,,,,,,,,,,88,106,70,48,29,44,14,1,29
McClellan Fire Incident Information: ,Humboldt,,37,8/1/14 15:47,8/2/14 08:00,40.4769416,-123.7155966,,,,,,,,,,,57,64,54,,,,,1,0
Eiler Fire Incident Information: ,Shasta,,32416,7/31/14 18:04,8/25/14 10:00,40.6860027,-121.418957,11,21,,,,8,78,1,,4,,,,,,,,1,0
Oregon Gulch Fire (part of the Beaver Complex) Incident Information: ,Siskiyou,,35302,7/30/14 23:00,8/18/14 09:45,39.329045,-121.6703204,,,,,,,,,,,84,99,70,52,33,55,18,1,16
Coffee Fire Incident Information: ,Shasta,,6258,7/30/14 20:30,11/14/14 13:00,38.54697607,-120.1545002,,,,,,,,,,,63,81,45,43,54,82,21,1,19
Little Deer Fire Incident Information: ,Siskiyou,,5503,7/31/14 17:45,8/18/14 10:00,39.90948484,-123.0347407,,,,,,,,,,,,,,,,,,1,0
Beaver Fire Incident Information: ,Siskiyou,,32496,7/30/14 00:00,9/2/14 13:00,38.6717639,-121.349863,,,,,,,,,,,84,99,70,46,26,43,16,1,14
July Complex Incident Information: ,Siskiyou,,50042,8/2/14 09:00,8/6/14 10:00,40.47030119,-121.5516369,,,,,,,,,,,86,104,68,39,28,51,4,1,29
Little Fire Incident Information: ,Modoc,,101,8/12/14 15:00,8/13/14 06:15,35.81469308,-119.6977286,,,,,,,,,,,84,100,70,52,33,47,20,1,23
Happy Camp Complex Incident Information: ,Siskiyou,,,8/11/14 22:00,8/14/14 09:30,41.7924649,-123.3799527,,,,,,,,,,,,,,,,,,1,0
Shoemaker Fire Incident Information: ,Los Angeles,,190,8/14/14 12:48,12/12/14 14:00,34.1364339,-117.8624841,,,,,,,,,,,73,91,57,61,63,93,38,1,26
Border Fire Incident Information: ,San Diego,,20,8/16/14 16:22,8/17/14 07:45,39.06083063,-117.895003,,,,,,,,,,,,,,,,,,1,0
Tecolote Fire Incident Information: ,Los Angeles,,274,8/17/14 14:30,12/12/14 13:30,33.68200039,-118.1094956,,,,,,,,,,,75,95,57,54,50,81,24,1,24
Junction Fire Incident Information: ,Madera,,612,8/18/14 13:50,8/25/14 08:25,37.3335501,-119.6491756,3,47,,,2,7,188,6,,3,86,100,70,45,30,51,9,1,21
Boca Fire Incident Information: ,Nevada,,84,8/18/14 10:00,8/19/14 16:45,39.3829915,-120.0860965,,,,,,,,,,,72,79,64,25,20,29,11,1,21
Way Fire Incident Information: ,Kern,,4045,8/18/14 14:30,8/27/14 18:00,34.93737815,-118.8177616,,,,,,,,,,,86,100,72,43,28,47,9,1,26
Dark Hole Fire Incident Information: ,Mariposa,,1080,7/17/14 01:00,8/20/14 19:00,37.8264309,-119.5957336,,,,,,,,,,,66,84,52,48,63,86,24,1,35
South Napa Earthquake Incident Information: ,Napa,,6,8/24/14 03:20,8/31/14 18:00,38.2986178,-122.2864419,,,,,,,,,,,66,77,55,55,73,100,46,1,35
Oregon Fire Incident Information: ,Trinity,,580,8/24/14 16:36,8/28/14 19:00,40.35304784,-123.2660679,2,1,,,,3,46,82,,,70,91,50,37,36,66,12,1,24
Pines Fire Incident Information: ,Madera,,10,8/26/14 16:23,12/12/14 13:45,37.3145262,-119.5418856,,,,,,,,,,,79,93,64,52,47,73,21,1,24
Casa Fire Incident Information: ,Santa Clara,,80,8/28/14 15:10,8/31/14 08:15,37.43948465,-121.5931828,,,,,,,,,,,72,88,55,59,80,100,40,1,37
Leopard Fire Incident Information: ,Shasta,,25,8/29/14 12:21,8/29/14 13:15,40.4857431,-122.146932,,,,,,,,,,,81,93,70,52,37,60,16,1,24
Interstate Fire Incident Information: ,Riverside,,25,9/1/14 14:03,9/1/14 22:00,33.95336643,-117.5605074,,,,,,,,,,,73,91,57,61,80,100,34,1,24
Saratoga Fire Incident Information: ,Lake,,100,9/3/14 16:03,9/5/14 18:30,39.16296,-122.917445,,,,,,,,,,,75,99,54,52,57,93,20,1,23
Jackson Fire Incident Information: ,Tuolumne,,70,9/4/14 11:51,9/5/14 09:15,37.90250812,-120.0507798,,,,,,,,,,,73,91,57,45,39,63,18,1,16
Bridge Fire Incident Information: ,Mariposa,,300,9/5/14 12:39,9/12/14 09:00,37.4326014,-119.7312034,3,,,,,,,,,,79,97,59,54,47,78,16,1,16
Meadow Fire Incident Information: ,Mariposa,,4772,8/16/14 00:00,12/12/14 13:45,37.7263152,-119.5276605,,,,,,,,,,,63,84,41,27,29,70,8,1,40
Montgomery Fire Incident Information: ,Mariposa,,79,9/7/14 16:46,9/9/14 19:45,38.32898185,-120.3887643,,,,,,,,,,,75,95,57,37,32,55,8,1,14
Gulch Fire Incident Information: ,Shasta,,1375,9/10/14 00:30,9/16/14 09:30,40.7562279,-122.0968406,4,4,,,,7,169,4,,2,70,95,46,28,26,50,7,1,14
Stage Coach Fire Incident Information: ,Napa,,27,9/11/14 15:14,9/15/14 14:20,38.6097407,-122.254045,,,,,,,,,,,72,90,52,55,63,100,26,1,23
Bald Hill 3 Fire Incident Information: ,Humboldt,,210,9/12/14 15:00,9/15/14 11:00,41.0491723,-123.6770485,,,,,,,,,,,54,64,45,48,93,100,65,1,11
Black Fire Incident Information: ,Mendocino,,403,9/13/14 15:48,9/17/14 16:10,39.254168,-123.1484806,3,11,,,,1,15,,,,79,100,57,39,37,62,11,1,24
King Fire Incident Information: ,El Dorado,,97717,9/13/14 16:32,10/9/14 17:20,38.7612923,-120.5865935,12,80,,,,,,,,,84,97,72,41,23,33,14,1,21
Silverado Fire Incident Information: ,Orange,,968,9/12/14 10:30,9/22/14 15:00,33.85108589,-117.7093631,,,,,,,,,,,79,97,59,57,51,81,27,1,23
Dog Bar Fire Incident Information: ,Nevada,,247,9/13/14 14:07,9/18/14 18:45,38.4241144,-120.4376912,,,,,,3,53,3,,1,79,95,63,37,25,39,11,1,13
Courtney Fire Incident Information: ,Madera,,320,9/14/14 13:36,9/22/14 07:15,37.45867351,-120.9082369,4,75,,,,4,90,2,,1,84,102,64,50,37,58,15,1,23
Boles Fire Incident Information: ,Siskiyou,,516,9/15/14 13:38,10/11/14 18:50,41.4226498,-122.3861269,1,172,101,,2,10,453,14,,,70,88,50,39,40,68,18,1,10
Irene Fire Incident Information: ,El Dorado,,94,9/14/14 09:15,9/17/14 18:45,38.5832424,-119.9796281,,,,,,,,,,,63,79,48,34,34,54,18,1,34
June Fire Incident Information: ,Inyo,,65,9/16/14 19:07,9/21/14 09:00,36.59581261,-118.4990741,,,,,,,,,,,,,,,,,,1,0
Nelson Fire Incident Information: ,Mendocino,,62,9/21/14 16:13,9/22/14 16:30,39.07042399,-122.9220086,,,,,,2,42,2,,,68,79,57,55,72,93,50,1,24
Cascade Fire Incident Information: ,El Dorado,,20,9/25/14 18:00,9/25/14 07:27,38.9499076,-120.1843551,,,,,,,,,,,50,55,45,45,87,93,69,1,21
Foothill Fire  Incident Information: ,Ventura,,25,9/29/14 19:35,9/30/14 15:00,34.2850137,-119.2273782,,,,,,,,,,,,81,55,,,,,1,0
Dog Rock Fire Incident Information: ,Mariposa,,311,10/7/14 15:05,10/12/14 18:00,37.40980963,-120.3759757,,,,,,,,,,,77,95,57,45,42,69,14,1,21
Applegate Fire Incident Information: ,Placer,,459,10/8/14 13:33,10/15/14 07:50,39.0017248,-120.9949426,2,10,,,,,,,,,75,90,63,37,28,45,14,1,19
Bane Fire Incident Information: ,San Bernardino,,48,10/16/14 14:34,10/17/14 18:15,33.9179635,-117.7245244,,,,,,,,,,,66,79,52,54,69,89,39,1,19
Round Fire Incident Information: ,Inyo,,7000,2/6/15 14:07,2/12/15 07:35,37.5579654,-118.6602287,4,45,,,1,7,100,6,,,57,81,34,12,28,52,3,1,47
Van Dyke Fire Incident Information: ,Mono,,509,2/6/15 16:52,2/20/15 19:00,38.2190315,-119.2409895,,,,,,,,,,,45,57,34,18,47,92,11,1,45
Stephens Fire Incident Information: ,Siskiyou,,200,2/24/15 12:15,3/2/15 09:00,38.71700656,-123.1364363,,,,,,,,,,,50,70,30,34,60,93,26,1,16
Ward Fire Incident Information: ,Plumas,,137,4/13/15 05:30,4/18/15 23:50,40.0754477,-120.8396752,,,,,,,,,,,,59,30,,,,,1,0
Highway Fire Incident Information: ,Riverside,,1049,4/18/15 18:12,4/24/15 07:30,33.8896049,-117.6413123,,,,,,4,54,3,,,61,82,37,37,44,75,19,1,24
Forebay Fire Incident Information: ,Merced,,275,5/11/15 10:26,5/11/15 12:15,37.06355228,-120.7814908,,,,,,,,,,,57,68,46,48,80,100,49,1,37
Christensen Fire Incident Information: ,Alameda,,242,5/28/15 17:00,5/28/15 10:30,37.51582396,-122.126264,,,,,,,,,,,66,81,54,50,58,83,33,1,27
Snow Fire Incident Information: ,Riverside,,25,6/5/15 13:32,6/5/15 19:00,34.00408109,-116.302737,,,,,,,,,,,,73,50,,,,,1,0
Harrison Fire Incident Information: ,Riverside,,80,6/1/15 10:16,6/5/15 16:32,33.5690591,-116.1808417,,,,,,,,,,,90,102,73,37,24,43,5,1,40
Site Fire Incident Information: ,Alameda,,300,6/5/15 20:22,6/6/15 07:15,37.7540634,-121.4533514,,,,,,,,,,,72,86,55,52,59,86,32,1,26
Oasis Fire Incident Information: ,Lake,,25,6/5/15 19:57,6/6/15 06:45,38.76600836,-123.0834591,,,,,,,,,,,64,77,50,52,66,89,43,1,26
FKU Lightning Fires Incident Information: ,Fresno,,45,6/5/15 17:00,6/6/15 20:00,37.0807823,-119.4854113,,,,,,,,,,,73,88,57,46,47,72,22,1,24
Fox Fire Incident Information: ,Mariposa,,25,6/7/15 12:06,6/9/15 09:00,37.48817648,-120.9416445,,,,,,5,60,2,,1,79,95,61,54,51,78,23,1,19
